Entry	Entry Name	Protein names	Gene Names	Mass	Interacts with	Subunit structure
P39605	NFRA1_BACSU	FMN reductase (NADPH) (EC 1.5.1.38) (NADPH-dependent FMN reductase) (NADPH-dependent nitro/flavin reductase) (NADPH-dependent nitroreductase) (NADPH-dependent oxidoreductase)	nfrA1 nfrA ywcG BSU38110 ipa-43d	28320		SUBUNIT: Homodimer. {ECO:0000305|PubMed:9836433}.
P39610	PDXK_BACSU	Pyridoxine kinase (EC 2.7.1.35) (PN/PL/PM kinase) (Pyridoxal kinase) (Pyridoxamine kinase) (Vitamin B6 kinase)	pdxK ywdB BSU38020 ipa-52r	29017		SUBUNIT: Homodimer. {ECO:0000269|PubMed:16978644}.
P39640	BACC_BACSU	Dihydroanticapsin 7-dehydrogenase (EC 1.1.1.385) (Bacilysin biosynthesis oxidoreductase BacC)	bacC ywfD BSU37720 ipa-82d	27080		
P39643	BACF_BACSU	Transaminase BacF (EC 2.6.1.-) (Transaminase A)	bacF ywfG BSU37690 ipa-85d	44703		SUBUNIT: Homodimer. {ECO:0000250|UniProtKB:Q93ZN9}.
P39645	CHDC_BACSU	Coproheme decarboxylase (EC 1.3.98.5) (Coproheme III oxidative decarboxylase) (Hydrogen peroxide-dependent heme synthase) (Iron-coproporphyrin oxidative decarboxylase)	chdC hemQ ywfI BSU37670 ipa-87r	29505		
P39751	MBL_BACSU	Cell shape-determining protein Mbl (Actin-like Mbl protein) (Rod shape-determining protein Mbl)	mbl BSU36410	35861	P33166	SUBUNIT: Forms polymers (PubMed:11290328, PubMed:19659933). Forms a complex with MreB and MreBH (PubMed:17064365, PubMed:19659933). Interacts with MreC (PubMed:17064365). {ECO:0000269|PubMed:11290328, ECO:0000269|PubMed:17064365, ECO:0000269|PubMed:19659933}.
P39757	MOAA_BACSU	GTP 3',8-cyclase (EC 4.1.99.22) (Molybdenum cofactor biosynthesis protein A)	moaA narA narAB BSU36700	38550		SUBUNIT: Monomer and homodimer. {ECO:0000255|HAMAP-Rule:MF_01225}.
P39763	MREBH_BACSU	Cell shape-determining protein MreBH (Actin-like MreBH protein) (Rod shape-determining protein MreBH)	mreBH BSU14470	35687		SUBUNIT: Forms polymers (PubMed:16950129). Forms a complex with Mbl and MreB (PubMed:19659933). Interacts with the C-terminal catalytic domain of LytE (PubMed:16950129). {ECO:0000269|PubMed:16950129, ECO:0000269|PubMed:19659933}.
P39764	KINC_BACSU	Sporulation kinase C (EC 2.7.13.3)	kinC mskA ssb BSU14490	48846		SUBUNIT: Oligomerizes, probably forms homodimers; oligomerization is assisted by FloT. Interacts with FloT (PubMed:26297017). Another study shows only rare colocalization with FloT or FloA membrane assemblies. KinC membrane assemblies are more mobile than FloT membrane assemblies (PubMed:27362352). {ECO:0000269|PubMed:26297017, ECO:0000269|PubMed:27362352}.
P39771	PURT_BACSU	Formate-dependent phosphoribosylglycinamide formyltransferase (EC 6.3.1.21) (5'-phosphoribosylglycinamide transformylase 2) (Formate-dependent GAR transformylase) (GAR transformylase 2) (GART 2) (Non-folate glycinamide ribonucleotide transformylase) (Phosphoribosylglycinamide formyltransferase 2)	purT BSU02230	42093		SUBUNIT: Homodimer. {ECO:0000255|HAMAP-Rule:MF_01643}.
P39795	TREC_BACSU	Trehalose-6-phosphate hydrolase (EC 3.2.1.93) (Alpha,alpha-phosphotrehalase) (Phospho-alpha-(1-1)-glucosidase)	treA treC BSU07810	65184		
P39812	GLTA_BACSU	Glutamate synthase [NADPH] large chain (EC 1.4.1.13) (NADPH-GOGAT)	gltA BSU18450	168772		SUBUNIT: Aggregate of 4 catalytic active heterodimers, consisting of a large and a small subunit. {ECO:0000250}.
P39813	DPRA_BACSU	DNA processing protein DprA (Protein Smf)	dprA smf BSU16110	32935	P16971	SUBUNIT: Interacts with RecA (PubMed:17803906). {ECO:0000269|PubMed:17803906}.
P39814	TOP1_BACSU	DNA topoisomerase 1 (EC 5.6.2.1) (DNA topoisomerase I) (Omega-protein) (Relaxing enzyme) (Swivelase) (Untwisting enzyme)	topA topI BSU16120	79078		SUBUNIT: Monomer. Interacts with the RNA polymerase core (PubMed:21710567). {ECO:0000255|HAMAP-Rule:MF_00952, ECO:0000269|PubMed:21710567}.
P39822	PSD_BACSU	Phosphatidylserine decarboxylase proenzyme (EC 4.1.1.65) [Cleaved into: Phosphatidylserine decarboxylase alpha chain; Phosphatidylserine decarboxylase beta chain]	psd BSU02290	29690		SUBUNIT: Heterodimer of a large membrane-associated beta subunit and a small pyruvoyl-containing alpha subunit. {ECO:0000255|HAMAP-Rule:MF_00662}.
P40407	NAMZ_BACSU	Peptidoglycan beta-N-acetylmuramidase NamZ (EC 3.2.1.92) (Exo-beta-N-acetylmuramidase NamZ) (ORF2)	namZ ybbC yzbB BSU01650	46036		SUBUNIT: Homodimer in solution. {ECO:0000269|PubMed:33684445}.
P40409	FEUA_BACSU	Iron-uptake system-binding protein	feuA BSU01630	35108		SUBUNIT: The complex is composed of one ATP-binding protein (YusV), two transmembrane proteins (FeuB and FeuC) and a solute-binding protein (FeuA). {ECO:0000305}.
P40758	GLNK_BACSU	Sensor histidine kinase GlnK (EC 2.7.13.3)	glnK nrgB ycbA yzgA BSU02440	46801	Q45666	SUBUNIT: Homotrimer (PubMed:17001076, PubMed:25691471). Under poor nitrogen source such as nitrate, the complex between GlnK and AmtB, which are the transmembrane ammonium transporter and its cognate regulator, respectively, interacts with TnrA (PubMed:17001076, PubMed:21435182, PubMed:25691471). GlnK-ATP complex are not able to bind TnrA (PubMed:21435182). {ECO:0000269|PubMed:17001076, ECO:0000269|PubMed:21435182, ECO:0000269|PubMed:25691471}.
P40762	PCHR_BACSU	HTH-type transcriptional regulator PchR (Pulcherriminic acid biosynthetis regulator)	pchR yvmB yzhA BSU35080	19682		SUBUNIT: Homodimer. {ECO:0000269|PubMed:27542896}.
P40806	PKSJ_BACSU	Polyketide synthase PksJ (PKS)	pksJ pksK BSU17180	562814		
P42068	HUTG_BACSU	Formimidoylglutamase (EC 3.5.3.8) (Formiminoglutamase) (Formiminoglutamate hydrolase) (N-formimino-L-glutamate formiminohydrolase)	hutG BSU39380 EE57C	35064		
P42084	HUTI_BACSU	Imidazolonepropionase (EC 3.5.2.7) (Imidazolone-5-propionate hydrolase)	hutI BSU39370 EE57B	45564		SUBUNIT: Homodimer. {ECO:0000269|PubMed:16990261}.
P42085	XPT_BACSU	Xanthine phosphoribosyltransferase (XPRTase) (EC 2.4.2.22)	xpt BSU22070	21038		SUBUNIT: Homodimer. {ECO:0000269|PubMed:16716072, ECO:0000269|Ref.4}.
P42106	QDOI_BACSU	Quercetin 2,3-dioxygenase (Quercetinase) (EC 1.13.11.24) (Flavonol 2,4-dioxygenase)	qdoI yxaG BSU39980 S14G	37600		SUBUNIT: Homodimer.
P42234	CATE_BACSU	Catalase-2 (EC 1.11.1.6)	katE katB BSU39050 N15D	77480		
P42252	TATCD_BACSU	Sec-independent protein translocase protein TatCd	tatC1 tatCd ycbT BSU02640	27706		SUBUNIT: Forms a complex with TatAd. Two types of complexes exist: one composed of TatAd and TatCd, and another composed only of TatAd. {ECO:0000255|HAMAP-Rule:MF_00902, ECO:0000269|PubMed:18029357}.
P42404	PHI_BACSU	3-hexulose-6-phosphate isomerase (EC 5.3.1.27) (6-phospho-3-hexuloisomerase) (PHI)	hxlB yckF BSU03450	19963		SUBUNIT: Homotetramer. {ECO:0000269|PubMed:15363790}.
P42410	RSBS_BACSU	RsbT antagonist protein RsbS (Stressosome protein RsbS)	rsbS ycxS BSU04680	13311	P42411	SUBUNIT: Interacts with RsbRA, RsbRB in the stressosome. The stressosome probably also contains RsbRC and RsbRD. {ECO:0000269|PubMed:15312768}.
P42415	IOLD_BACSU	3D-(3,5/4)-trihydroxycyclohexane-1,2-dione hydrolase (THcHDO hydrolase) (EC 3.7.1.22)	iolD yxdD BSU39730 E83D	70380		
P42425	LON2_BACSU	Lon protease 2 (EC 3.4.21.53) (ATP-dependent protease La 2)	lon2 lonB ysxF BSU28210	60429		SUBUNIT: Homohexamer. Organized in a ring with a central cavity (By similarity). {ECO:0000250}.
P42435	NASD_BACSU	Nitrite reductase [NAD(P)H] (EC 1.7.1.4)	nasD nasBC nirB BSU03300	88432		SUBUNIT: Homodimer. {ECO:0000250}.
P42923	RL10_BACSU	Large ribosomal subunit protein uL10 (50S ribosomal protein L10) (BL5) (Cold acclimatization protein) (CAP) (Vegetative protein 300) (VEG300)	rplJ BSU01040	18079		SUBUNIT: Part of the ribosomal stalk of the 50S ribosomal subunit. The N-terminus interacts with L11 and 23S rRNA to form the base of the stalk. The C-terminus forms an elongated spine to which L12 dimers bind in a sequential fashion forming a pentameric L10(L12)2(L12)2 complex. {ECO:0000269|PubMed:15923259, ECO:0000269|PubMed:20467040}.
P42954	TAGH_BACSU	Teichoic acids export ATP-binding protein TagH (EC 7.5.2.4) (Teichoic acid-transporting ATPase)	tagH BSU35700	59244	Q01467; P42953	SUBUNIT: The complex is composed of two ATP-binding proteins (TagH) and two transmembrane proteins (TagG). {ECO:0000255|HAMAP-Rule:MF_01715}.
P42958	TTUC_BACSU	Probable tartrate dehydrogenase/decarboxylase (TDH) (EC 1.1.1.93) (EC 4.1.1.73) (D-malate dehydrogenase [decarboxylating]) (EC 1.1.1.83)	ycsA BSU04000	38728		
P42962	YCSE_BACSU	5-amino-6-(5-phospho-D-ribitylamino)uracil phosphatase YcsE (EC 3.1.3.104)	ycsE BSU04040	28186		
P42974	DHNA_BACSU	NADH dehydrogenase (EC 7.1.1.2) (Alkyl hydroperoxide reductase)	ahpF ndh BSU40100	54874		SUBUNIT: Homodimer. {ECO:0000250}.
P42977	CCA_BACSU	CCA-adding enzyme (EC 2.7.7.72) (CCA tRNA nucleotidyltransferase) (tRNA CCA-pyrophosphorylase) (tRNA adenylyl-/cytidylyl- transferase) (tRNA nucleotidyltransferase) (tRNA-NT)	cca papS ypjI BSU22450	45452		SUBUNIT: Homodimer. {ECO:0000255|HAMAP-Rule:MF_01263}.
P45858	MMGD_BACSU	Citrate/2-methylcitrate synthase (EC 2.3.3.-) (EC 2.3.3.16) (2-methylcitrate synthase) (2-MCS) (MCS) (Citrate synthase)	mmgD yqiO BSU24140	42106		
P46321	LICR_BACSU	Probable licABCH operon regulator [Includes: Putative phosphotransferase enzyme IIB component (EC 2.7.1.-) (Putative PTS system EIIB component); Putative phosphotransferase enzyme IIA component (Putative PTS system EIIA component)]	licR celR BSU38600	73315		
P46336	IOLS_BACSU	Aldo-keto reductase IolS (EC 1.1.1.-) (AKR11A) (Vegetative protein 147) (VEG147)	iolS yxbF BSU39780 SS92ER	35168		SUBUNIT: Monomer. {ECO:0000269|PubMed:12554958}.
P46344	PGPH_BACSU	Cyclic-di-AMP phosphodiesterase PgpH (c-di-AMP phosphodiesterase) (EC 3.1.4.59)	pgpH yqfF BSU25330	79167		
P46350	RXL7_BACSU	RNA-binding protein YbxF (Putative large ribosomal subunit protein eL8) (Ribosome-associated protein L7Ae-like)	rulS rplGB ybaB ybxF BSU01090	8462		SUBUNIT: Found associated with the 50S subunit of the ribosome during exponential growth but not during stationary phase. {ECO:0000269|PubMed:22355167, ECO:0000269|PubMed:23892783}.
P46354	PUNA_BACSU	Purine nucleoside phosphorylase 1 (PNP 1) (EC 2.4.2.1) (Inosine phosphorylase) (Inosine-guanosine phosphorylase) (Purine nucleoside phosphorylase I) (PNP I) (Pu-NPase I)	punA deoD pnp yqkO BSU23490	29127		SUBUNIT: Homotrimer. {ECO:0000250|UniProtKB:P77834}.
P49782	SP3AE_BACSU	Stage III sporulation protein AE	spoIIIAE BSU24390	42921		SUBUNIT: Interacts with SpoIIIJ and YqjG. {ECO:0000269|PubMed:18820020}.
P49814	MDH_BACSU	Malate dehydrogenase (EC 1.1.1.37) (Vegetative protein 69) (VEG69)	mdh citH BSU29120	33644	P39126	
P50620	RIR1_BACSU	Ribonucleoside-diphosphate reductase subunit alpha (EC 1.17.4.1) (Ribonucleotide reductase large subunit)	nrdE nrdA BSU17380	80689		SUBUNIT: Tetramer of two alpha and two beta subunits. {ECO:0000250}.
P50726	FMNP_BACSU	Riboflavin transporter FmnP (FMN permease) (Riboflavin ECF transporter S component FmnP)	fmnP ribU ypaA BSU23050	20553		SUBUNIT: Forms a stable energy-coupling factor (ECF) transporter complex composed of a membrane-embedded substrate-binding protein (S component), 2 ATP-binding proteins (A component) and 2 transmembrane proteins (T component). May be able to interact with more than 1 S component at a time (By similarity). {ECO:0000250}.
P50729	RECS_BACSU	Probable ATP-dependent DNA helicase RecS (EC 5.6.2.4) (Probable DNA 3'-5' helicase RecS) (Recombination protein S)	recS ypbC BSU23020	56508		
P50735	GUDB_BACSU	Cryptic catabolic NAD-specific glutamate dehydrogenase GudB (NAD-GDH) (EC 1.4.1.2)	gudB ypcA BSU22960	47340		SUBUNIT: Homohexamer. {ECO:0000269|PubMed:20630473}.
P50736	BDR_BACSU	Bacilliredoxin reductase Bdr (EC 1.8.1.-) (Bacillithiol-disulfide reductase) (BSSB reductase) (NADPH-dependent disulfide oxidoreductase) (Thioredoxin reductase-like flavoprotein) (YpdA family putative bacillithiol disulfide reductase)	bdr ypdA BSU22950 HIR78_13750	36409		SUBUNIT: Interacts with BrxC. {ECO:0000269|PubMed:33722570}.
P50738	PRSW_BACSU	Protease PrsW (EC 3.4.-.-) (Protease responsible for activating sigma-W) (Site-1 protease PrsW) (S1P protease PrsW)	prsW ypdC BSU22940	24719		
P50740	IDI2_BACSU	Isopentenyl-diphosphate delta-isomerase (IPP isomerase) (EC 5.3.3.2) (Isopentenyl diphosphate:dimethylallyl diphosphate isomerase) (Isopentenyl pyrophosphate isomerase) (Type 2 isopentenyl diphosphate isomerase) (IDI-2)	fni idi ypgA BSU22870	37221		SUBUNIT: Homooctamer. Dimer of tetramers. {ECO:0000255|HAMAP-Rule:MF_00354, ECO:0000269|PubMed:12798687}.
P50743	DER_BACSU	GTPase Der (GTP-binding protein EngA)	der engA yphC BSU22840	48770		SUBUNIT: Cofractionates with the 70S ribosome; association is stabilized by the non-hydrolyzable GTP analog GMPPNP, and inhibited by GTP or GDP.
P50848	CBP1_BACSU	Carboxypeptidase 1 (EC 3.4.17.19) (BsuCP)	ypwA BSU22080	58175		SUBUNIT: Homodimer. {ECO:0000269|PubMed:19544567}.
P50863	APBC_BACSU	Iron-sulfur cluster carrier protein	salA mrp rec233 ybaL ybxI BSU01540	38639		SUBUNIT: Homodimer (By similarity). Interacts with BrxC (PubMed:33722570). {ECO:0000255|HAMAP-Rule:MF_02040, ECO:0000269|PubMed:33722570}.
P50866	CLPX_BACSU	ATP-dependent Clp protease ATP-binding subunit ClpX	clpX BSU28220	46350		SUBUNIT: Component of the ClpX-ClpP complex. Forms a hexameric ring that, in the presence of ATP, binds to fourteen ClpP subunits assembled into a disk-like structure with a central cavity, resembling the structure of eukaryotic proteasomes. {ECO:0000255|HAMAP-Rule:MF_00175}.
P51785	ILVD_BACSU	Dihydroxy-acid dehydratase (DAD) (EC 4.2.1.9) (Vegetative protein 110) (VEG110)	ilvD BSU21870	59500		SUBUNIT: Homodimer. {ECO:0000255|HAMAP-Rule:MF_00012}.
P51833	RNC_BACSU	Ribonuclease 3 (EC 3.1.26.3) (Ribonuclease III) (RNase III)	rnc rncS BSU15930	28425		SUBUNIT: Homodimer. {ECO:0000250}.
P54178	SCO1_BACSU	SCO1 protein homolog (BsSco)	ypmQ BSU21750	21718		SUBUNIT: Monomer. {ECO:0000269|PubMed:15723536}.
P54450	CWLH_BACSU	N-acetylmuramoyl-L-alanine amidase CwlH (EC 3.5.1.28) (Autolysin) (Cell wall hydrolase)	cwlH yqeE BSU25710	27571		
P54462	MTAB_BACSU	Threonylcarbamoyladenosine tRNA methylthiotransferase MtaB (EC 2.8.4.5) (tRNA-t(6)A37 methylthiotransferase)	mtaB tmtB yqeV BSU25430	51658		
P54471	TRMK_BACSU	tRNA (adenine(22)-N(1))-methyltransferase (EC 2.1.1.217) (TrMet(m1A22)) (tRNA(m1A22)-methyltransferase) (tRNA(m1A22)MTase)	trmK yqfN BSU25180	26162		
P54495	GLK_BACSU	Glucokinase (EC 2.7.1.2) (Glucose kinase)	glcK yqgR BSU24850	33604		
P54504	RSBRD_BACSU	RsbT co-antagonist protein RsbRD (Stressosome protein RsbRD)	rsbRD yqhA BSU24760	31835		SUBUNIT: Probably present in the stressosome with RsbRA, RsbRB, RsbRC and RsbS.
P54544	MISCB_BACSU	Membrane protein insertase MisCB (Foldase YidC 1) (Membrane integrase YidC 1) (Membrane protein YidC 1)	misCB yqjG BSU23890	30748		SUBUNIT: Mostly monomeric, it may also form dimers. Interacts with SpoIIIAE. Forms a complex with the F(1)F(0) ATP synthase in which can be found the alpha, beta, gamma, delta and epsilon subunits of F(1) and a, b and subunits of F(0). YqgA is found in the same complex. {ECO:0000269|PubMed:18820020, ECO:0000269|PubMed:19717609}.
P54548	RNZ_BACSU	Ribonuclease Z (RNase Z) (EC 3.1.26.11) (tRNA 3 endonuclease) (tRNase Z)	rnz yqjK BSU23840	34023	P54548	SUBUNIT: Homodimer. {ECO:0000255|HAMAP-Rule:MF_01818, ECO:0000269|PubMed:15654328, ECO:0000269|PubMed:16518398}.
P54572	MAO1_BACSU	NAD-dependent malic enzyme 1 (NAD-ME 1) (EC 1.1.1.38) (Malate dehydrogenase MleA)	mleA yqkJ BSU23550	45890		
P54574	FUR_BACSU	Ferric uptake regulation protein (Ferric uptake regulator)	fur yqkL BSU23520	17428		SUBUNIT: Homodimer. {ECO:0000250}.
P54576	MCPC_BACSU	Methyl-accepting chemotaxis protein McpC	mcpC prg71 BSU13950	72031		SUBUNIT: Interacts with FloT. {ECO:0000269|PubMed:23651456}.
P54603	SRTD_BACSU	Sortase D (EC 3.4.22.-)	srtD srtA yhcS BSU09200	21976		
P54715	PTOCB_BACSU	PTS system maltose-specific EIICB component [Includes: Maltose permease IIC component (PTS system maltose-specific EIIC component); Maltose-specific phosphotransferase enzyme IIB component (EC 2.7.1.208) (PTS system maltose-specific EIIB component)]	malP glv-2 glvC glvCB yfiB BSU08200	58055		
P54955	SCMP_BACSU	N-acetylcysteine deacetylase (EC 3.5.1.-) (S-(2-succino)cysteine metabolism operon protein P)	scmP sndB yxeP BSU39470 LP9H	41552		
P60495	PXPB_BACSU	5-oxoprolinase subunit B (5-OPase subunit B) (EC 3.5.2.9) (5-oxoprolinase (ATP-hydrolyzing) subunit B) (Antikinase KipI) (Kinase A inhibitor) (Sporulation inhibitor KipI)	pxpB kipI ycsJ BSU04080	26720		SUBUNIT: Forms a complex composed of PxpA, PxpB and PxpC (PubMed:28830929). Interacts with PxpC (KipA) (PubMed:21050859, PubMed:28830929, PubMed:9334321). Interaction with PxpC prevents the inhibitory action of PxpB (KipI) (PubMed:21050859, PubMed:9334321). Interacts with KinA. Two PxpB monomers bind via their C-domains at a conserved proline in the KinA dimerization and histidine-phosphotransfer (DHp) domain (PubMed:18823995). {ECO:0000269|PubMed:18823995, ECO:0000269|PubMed:21050859, ECO:0000269|PubMed:28830929, ECO:0000269|PubMed:9334321}.
P68579	SUNT_BACSU	SPbeta prophage-derived sublancin-168-processing and transport ATP-binding protein SunT (EC 3.4.22.-) (EC 7.-.-.-)	sunT yolH BSU21470	81564		SUBUNIT: Homodimer. {ECO:0000250}.
P70962	RAPB_BACSU	Response regulator aspartate phosphatase B (EC 3.1.3.-) (Protein-aspartate phosphatase RapB) (Stage 0 sporulation protein P)	rapB spo0P ywmE BSU36690	45037		SUBUNIT: Homodimer (PubMed:11923303). Interacts with Spo0F (PubMed:9843420). {ECO:0000269|PubMed:11923303, ECO:0000269|PubMed:9843420}.
P70965	MURA1_BACSU	UDP-N-acetylglucosamine 1-carboxyvinyltransferase 1 (EC 2.5.1.7) (Enoylpyruvate transferase 1) (UDP-N-acetylglucosamine enolpyruvyl transferase 1) (EPT 1)	murAA murA BSU36760	46701		
P71001	PHRF_BACSU	RapF inhibitor (Signaling peptide PhrF)	phrF ywhI BSU37470	4199	P71002	SUBUNIT: Interacts with RapF and inhibits its interaction with ComA. {ECO:0000269|PubMed:15968044, ECO:0000269|PubMed:22215984, ECO:0000269|PubMed:23526880}.
P71011	ALBA_BACSU	Antilisterial bacteriocin subtilosin biosynthesis protein AlbA (EC 1.21.98.-)	albA ywiA BSU37370	51514		
P71014	BSLA_BACSU	Biofilm-surface layer protein A (ORF-1)	bslA yuaB BSU31080	19257		SUBUNIT: Forms polymers. {ECO:0000269|PubMed:22571672, ECO:0000269|PubMed:23904481}.
P71017	GBSB_BACSU	Choline dehydrogenase (EC 1.1.1.-) (Alcohol dehydrogenase)	gbsB BSU31050	43421		
P71018	PLSX_BACSU	Phosphate acyltransferase (EC 2.3.1.274) (Acyl-ACP phosphotransacylase) (Acyl-[acyl-carrier-protein]--phosphate acyltransferase) (Phosphate-acyl-ACP acyltransferase)	plsX ylpD BSU15890	35763		SUBUNIT: Homodimer (By similarity). Probably interacts with PlsY. {ECO:0000255|HAMAP-Rule:MF_00019, ECO:0000269|PubMed:19282621}.
P71040	CLSA_BACSU	Major cardiolipin synthase ClsA (CL synthase 2) (EC 2.7.8.-)	clsA ywnE BSU36590	55866		
P71063	EPSM_BACSU	UDP-N-acetylbacillosamine N-acetyltransferase (EC 2.3.1.203)	epsM yvfD BSU34240	22483		SUBUNIT: Forms oligomers. {ECO:0000269|PubMed:30314705}.
P80698	TIG_BACSU	Trigger factor (TF) (EC 5.2.1.8) (PPIase) (Vegetative protein 2) (VEG2)	tig yzzH BSU28230	47487		
P80859	6PGD_BACSU	6-phosphogluconate dehydrogenase, NADP(+)-dependent, decarboxylating (EC 1.1.1.44) (GNTZII)	gndA yqjI BSU23860	51775		SUBUNIT: Homodimer. {ECO:0000250}.
P80860	G6PI_BACSU	Glucose-6-phosphate isomerase (GPI) (EC 5.3.1.9) (Phosphoglucose isomerase) (PGI) (Phosphohexose isomerase) (PHI) (Vegetative protein 54) (VEG54)	pgi yugL BSU31350	50543		
P80864	TPX_BACSU	Thiol peroxidase (Tpx) (EC 1.11.1.24) (Peroxiredoxin tpx) (Prx) (Thioredoxin peroxidase) (Thioredoxin-dependent peroxiredoxin)	tpx ytgI BSU29490	18216		SUBUNIT: Homodimer. {ECO:0000255|HAMAP-Rule:MF_00269}.
P80868	EFG_BACSU	Elongation factor G (EF-G) (Vegetative protein 19) (VEG19)	fusA fus BSU01120	76617		
P80874	GS69_BACSU	Aldo-keto reductase YhdN (EC 1.1.1.-) (AKR11B) (General stress protein 69) (GSP69)	yhdN BSU09530	37312		SUBUNIT: Monomer. {ECO:0000269|PubMed:12554958}.
P80877	METE_BACSU	5-methyltetrahydropteroyltriglutamate--homocysteine methyltransferase (EC 2.1.1.14) (Cobalamin-independent methionine synthase) (Methionine synthase, vitamin-B12 independent isozyme) (Superoxide-inducible protein 9) (SOI9)	metE metC BSU13180	86806		
P80886	SUCC_BACSU	Succinate--CoA ligase [ADP-forming] subunit beta (EC 6.2.1.5) (Succinyl-CoA synthetase subunit beta) (SCS-beta)	sucC BSU16090	41372		SUBUNIT: Heterotetramer of two alpha and two beta subunits (By similarity). Interacts with BrxC (PubMed:33722570). {ECO:0000255|HAMAP-Rule:MF_00558, ECO:0000269|PubMed:33722570}.
P94360	MSMX_BACSU	Oligosaccharides import ATP-binding protein MsmX (EC 7.5.2.-) (Maltodextrin import ATP-binding protein MsmX) (Melibiose/raffinose/stachyose import ATP-binding protein MsmX)	msmX yxkG BSU38810	41366		SUBUNIT: The complex involved in maltodextrin import is composed of two ATP-binding proteins (MsmX), two transmembrane proteins (MdxF and MdxG) and a solute-binding protein (MdxE) (PubMed:16707683). The complex involved in arabinooligosaccharides uptake is composed of two ATP-binding proteins (MsmX), two transmembrane proteins (AraP and AraQ) and a solute-binding protein (AraN) (PubMed:20693325). The complex involved in galactooligosaccharides uptake is composed of two ATP-binding proteins (MsmX), two transmembrane proteins (GanP and GanQ) and a solute-binding protein (GanS) (PubMed:27501980, PubMed:29240795). The complex involved in melibiose, raffinose and stachyose import is composed of two ATP-binding proteins (MsmX), two transmembrane proteins (MelC and MelD) and a solute-binding protein (MelE) (PubMed:31138628). The complex involved in polygalacturonan and rhamnogalacturonan type I uptake is probably composed of two ATP-binding proteins (MsmX), two transmembrane proteins (YtcP and YteP) and a solute-binding protein (YtcQ) (PubMed:29240795). {ECO:0000269|PubMed:16707683, ECO:0000269|PubMed:20693325, ECO:0000269|PubMed:27501980, ECO:0000269|PubMed:29240795, ECO:0000269|PubMed:31138628}.
P94368	NNRD_BACSU	ADP-dependent (S)-NAD(P)H-hydrate dehydratase (EC 4.2.1.136) (ADP-dependent NAD(P)HX dehydratase)	nnrD yxkO BSU38720	29870		SUBUNIT: Homotetramer. {ECO:0000255|HAMAP-Rule:MF_01965, ECO:0000269|PubMed:12457846, ECO:0000269|PubMed:22940582}.
P94390	PROD2_BACSU	Proline dehydrogenase 2 (PRODH 2) (EC 1.5.5.2) (Proline oxidase 2)	putB ycgM BSU03200	35046		
P94391	ROCA2_BACSU	1-pyrroline-5-carboxylate dehydrogenase 2 (P5C dehydrogenase 2) (EC 1.2.1.88) (L-glutamate gamma-semialdehyde dehydrogenase)	putC ycgN BSU03210	56424		
P94392	PUTP_BACSU	High-affinity proline transporter PutP	putP ycgO BSU03220	51144		
P94404	PADL_BACSU	Probable UbiX-like flavin prenyltransferase (EC 2.5.1.129) (Phenolic acid decarboxylase subunit B) (PAD)	bsdB ubiX yclB BSU03630	22539		SUBUNIT: Homododecamer. {ECO:0000255|HAMAP-Rule:MF_01986}.
P94415	RAPC_BACSU	Regulatory protein RapC (Rap protein C)	rapC yclL BSU03770	45635		SUBUNIT: Homodimer (PubMed:12950917). Interacts specifically with the C-terminal DNA-binding domain of ComA (PubMed:12950917, PubMed:15968044). Interacts with CSF (PubMed:12950917). {ECO:0000269|PubMed:12950917, ECO:0000269|PubMed:15968044}.
P94417	AK3_BACSU	Aspartokinase 3 (EC 2.7.2.4) (Aspartate kinase 3) (Aspartokinase III)	yclM BSU03790	49825		SUBUNIT: Monomer. {ECO:0000269|PubMed:11471740}.
P94421	YCLQ_BACSU	Petrobactin-binding protein YclQ	yclQ BSU03830	34792		SUBUNIT: The complex is composed of two ATP-binding proteins (YclP), two transmembrane proteins (YclN and YclO) and a solute-binding protein (YclQ) (Probable). Interacts with FloT (PubMed:23651456). {ECO:0000269|PubMed:23651456, ECO:0000305|PubMed:19955416}.
P94427	GABT_BACSU	Probable 4-aminobutyrate aminotransferase (EC 2.6.1.19) ((S)-3-amino-2-methylpropionate transaminase) (EC 2.6.1.22) (GABA aminotransferase) (GABA-AT) (Gamma-amino-N-butyrate transaminase) (GABA transaminase) (Glutamate:succinic semialdehyde transaminase) (L-AIBAT)	gabT ycnG BSU03900	47249		
P94428	GABD_BACSU	Succinate-semialdehyde dehydrogenase [NADP(+)] (SSDH) (EC 1.2.1.79)	gabD ycnH BSU03910	50262		
P94438	LNRJ_BACSU	Sensor histidine kinase LnrJ (EC 2.7.13.3)	lnrJ linJ yfiJ BSU08290	44543		
P94461	PRIA_BACSU	Primosomal protein N' (EC 3.6.4.-) (ATP-dependent helicase PriA)	priA yloJ BSU15710	91353		SUBUNIT: Component of the primosome. {ECO:0000255|HAMAP-Rule:MF_00983}.
P94498	CYSH1_BACSU	Adenosine 5'-phosphosulfate reductase 1 (APS reductase 1) (EC 1.8.4.10) (5'-adenylylsulfate reductase 1) (Thioredoxin-dependent 5'-adenylylsulfate reductase 1)	cysH BSU15570	26975		
P94512	PSP_BACSU	Phosphoserine phosphatase (PSP) (EC 3.1.3.3)	serB ysaA BSU28940	29581		
P94526	ARAL_BACSU	Sugar-phosphatase AraL (EC 3.1.3.23) (Arabinose operon protein AraL) (Phosphoserine phosphatase) (EC 3.1.3.3)	araL yseA BSU28770	29315		
P94541	RNH3_BACSU	Ribonuclease HIII (RNase HIII) (EC 3.1.26.4)	rnhC ysgB BSU28620	34070		SUBUNIT: Interacts with the RNA polymerase core. {ECO:0000269|PubMed:21710567}.
P94558	IXTPA_BACSU	dITP/XTP pyrophosphatase (EC 3.6.1.66) (Non-canonical purine NTP pyrophosphatase) (Non-standard purine NTP pyrophosphatase) (Nucleoside-triphosphate diphosphatase) (Nucleoside-triphosphate pyrophosphatase) (NTPase)	ysnA BSU28360	21933		SUBUNIT: Homodimer. {ECO:0000255|HAMAP-Rule:MF_01405}.
P94571	BCRC_BACSU	Undecaprenyl-diphosphatase BcrC (EC 3.6.1.27) (Undecaprenyl pyrophosphate phosphatase)	bcrC ywoA BSU36530	21723		
P96503	FLIW_BACSU	Flagellar assembly factor FliW	fliW yviF BSU35380	16170		SUBUNIT: Interacts with flagellin in a 1:1 complex (PubMed:16936039, PubMed:21895793). Two molecules interact with each CsrA dimer; cannot interact with both flagellin and CsrA simultaneously (PubMed:21895793, PubMed:27516547). Has a higher affinity for CsrA than for flagellin (PubMed:21895793). Interacts directly with flagellin (hag), forms a 3-way complex of Hag, FliS and FliW in which Flis and FliW do not directly interact (PubMed:23144244). Interaction with Hag may occur via the C-terminus of Hag (PubMed:16936039). {ECO:0000269|PubMed:16936039, ECO:0000269|PubMed:21895793, ECO:0000269|PubMed:23144244, ECO:0000269|PubMed:27516547}.
