Entry	Entry Name	Protein names	Gene Names	Mass	Interacts with	Subunit structure
P35159	RLUB_BACSU	Ribosomal large subunit pseudouridine synthase B (EC 5.4.99.22) (23S rRNA pseudouridine(2605) synthase) (rRNA pseudouridylate synthase B) (rRNA-uridine isomerase B)	rluB ypuL BSU23160	27738		
P35163	RESD_BACSU	Transcriptional regulatory protein ResD	resD ypxD BSU23120	27515		SUBUNIT: Interacts with the RNA polymerase core. {ECO:0000269|PubMed:21710567}.
P35165	SIGX_BACSU	ECF RNA polymerase sigma factor SigX (ECF sigma factor SigX)	sigX ypuM BSU23100	23223		SUBUNIT: Interacts transiently with the RNAP core. {ECO:0000305|PubMed:21710567}.
P35535	FLIQ_BACSU	Flagellar biosynthetic protein FliQ	fliQ BSU16360	9713		
P35537	FLIR_BACSU	Flagellar biosynthetic protein FliR	fliR BSU16370	28636		
P35538	FLHB_BACSU	Flagellar biosynthetic protein FlhB	flhB BSU16380	41097		
P35620	FLHA_BACSU	Flagellar biosynthesis protein FlhA	flhA BSU16390	73977	P20487	
P36839	ARGD_BACSU	Acetylornithine aminotransferase (ACOAT) (EC 2.6.1.11)	argD BSU11220	40978		SUBUNIT: Homodimer. {ECO:0000255|HAMAP-Rule:MF_01107}.
P36945	RBSK_BACSU	Ribokinase (RK) (EC 2.7.1.15)	rbsK BSU35920	31138		SUBUNIT: Homodimer. {ECO:0000255|HAMAP-Rule:MF_01987}.
P36947	RBSA_BACSU	Ribose import ATP-binding protein RbsA (EC 7.5.2.7)	rbsA BSU35940	54532		SUBUNIT: The complex is composed of an ATP-binding protein (RbsA), two transmembrane proteins (RbsC) and a solute-binding protein (RbsB). {ECO:0000255|HAMAP-Rule:MF_01716}.
P36949	RBSB_BACSU	Ribose import binding protein RbsB	rbsB BSU35960	32227		SUBUNIT: The complex is composed of an ATP-binding protein (RbsA), two transmembrane proteins (RbsC) and a solute-binding protein (RbsB) (By similarity). Interacts with FloT (PubMed:23651456). {ECO:0000250|UniProtKB:P02925, ECO:0000269|PubMed:23651456}.
P37105	SRP54_BACSU	Signal recognition particle protein (EC 3.6.5.4) (Fifty-four homolog)	ffh BSU15980	49541		SUBUNIT: Part of the signal recognition particle protein translocation system, which is composed of SRP and FtsY (By similarity). Interacts with a small cytoplasmic RNA (sc-RNA). {ECO:0000255|HAMAP-Rule:MF_00306, ECO:0000269|PubMed:7511896}.
P37252	ILVH_BACSU	Acetolactate synthase small subunit (EC 2.2.1.6) (Acetohydroxy-acid synthase small subunit) (AHAS) (ALS)	ilvH ilvN BSU28300	18925		SUBUNIT: Dimer of large and small chains. {ECO:0000250}.
P37454	EXOA_BACSU	Exodeoxyribonuclease (EC 3.1.11.2)	exoA BSU40880	29252		
P37464	SYS_BACSU	Serine--tRNA ligase (EC 6.1.1.11) (Seryl-tRNA synthetase) (SerRS) (Seryl-tRNA(Ser/Sec) synthetase)	serS BSU00130	48842		SUBUNIT: Homodimer. The tRNA molecule binds across the dimer. {ECO:0000255|HAMAP-Rule:MF_00176}.
P37465	SYM_BACSU	Methionine--tRNA ligase (EC 6.1.1.10) (Methionyl-tRNA synthetase) (MetRS)	metG metS BSU00380	76188		SUBUNIT: Homodimer. {ECO:0000250}.
P37466	VEG_BACSU	Protein Veg	veg BSU00440	9550		
P37468	RSMA_BACSU	Ribosomal RNA small subunit methyltransferase A (EC 2.1.1.182) (16S rRNA (adenine(1518)-N(6)/adenine(1519)-N(6))-dimethyltransferase) (16S rRNA dimethyladenosine transferase) (16S rRNA dimethylase) (S-adenosylmethionine-6-N', N'-adenosyl(rRNA) dimethyltransferase)	rsmA ksgA BSU00420	32721		
P37474	MFD_BACSU	Transcription-repair-coupling factor (TRCF) (EC 3.6.4.-)	mfd BSU00550	133812		
P37477	SYK_BACSU	Lysine--tRNA ligase (EC 6.1.1.6) (Lysyl-tRNA synthetase) (LysRS)	lysS BSU00820	57539		SUBUNIT: Homodimer. {ECO:0000250}.
P37515	MAA_BACSU	Probable maltose O-acetyltransferase (EC 2.3.1.79) (Maltose transacetylase)	maa yyaI BSU40850	20210		SUBUNIT: Homodimer. {ECO:0000250|UniProtKB:P77791}.
P37517	CCPB_BACSU	Catabolite control protein B	ccpB yyaG BSU40870	34847		SUBUNIT: Seems to be complexed to phosphorylated HPr.
P37518	YCHF_BACSU	Ribosome-binding ATPase YchF	ychF engD yyaF BSU40920	40069		
P37522	SOJ_BACSU	Sporulation initiation inhibitor protein Soj (EC 3.6.-.-)	soj orf253 BSU40970	27543	P05648	
P37524	NOC_BACSU	Nucleoid occlusion protein (Noc)	noc yyaA BSU40990	32795		
P37537	KTHY_BACSU	Thymidylate kinase (EC 2.7.4.9) (dTMP kinase)	tmk yaaP BSU00280	23866		
P37538	DARA_BACSU	Cyclic di-AMP receptor A (c-di-AMP receptor A) (PII-like signal transduction protein DarA)	darA yaaQ BSU00290	11967		SUBUNIT: Homotrimer. {ECO:0000269|PubMed:25433025}.
P37540	HOLB_BACSU	DNA polymerase III subunit delta' (EC 2.7.7.7)	holB yaaS BSU00310	37621		SUBUNIT: DNA polymerase III contains a core (composed of alpha, epsilon and theta chains) that associates with a tau subunit. This core dimerizes to form the POLIII' complex. PolIII' associates with the gamma complex (composed of gamma, delta, delta', psi and chi chains) and with the beta chain to form the complete DNA polymerase III complex (By similarity). {ECO:0000250}.
P37546	YABE_BACSU	Putative cell wall shaping protein YabE	yabE BSU00400	44209		
P37548	YABG_BACSU	Sporulation-specific protease YabG (EC 3.4.-.-)	yabG BSU00430	33318		
P37550	ISPE_BACSU	4-diphosphocytidyl-2-C-methyl-D-erythritol kinase (CMK) (EC 2.7.1.148) (4-(cytidine-5'-diphospho)-2-C-methyl-D-erythritol kinase)	ispE ipk yabH BSU00460	31720		
P37551	PURR_BACSU	Pur operon repressor	purR yabI BSU00470	31229		SUBUNIT: Homodimer.
P37553	FIN_BACSU	Anti-sigma-F factor Fin (Suppressor of recU and recB SubA)	fin subA yabK BSU00540	8848		
P37558	YABP_BACSU	Spore protein YabP	yabP BSU00600	11403		
P37559	YABQ_BACSU	Spore protein YabQ	yabQ BSU00610	25092		
P37562	PKN1_BACSU	Probable serine/threonine-protein kinase YabT (EC 2.7.11.1)	yabT BSU00660	37666	O34507; P45870; P16971; O31435; P96716	
P37563	TILS_BACSU	tRNA(Ile)-lysidine synthase (EC 6.3.4.19) (tRNA(Ile)-2-lysyl-cytidine synthase) (tRNA(Ile)-lysidine synthetase)	tilS yacA BSU00670	53464		
P37567	DUS1_BACSU	Probable tRNA-dihydrouridine synthase 1 (EC 1.3.1.-)	dus1 yacF BSU00810	37066		
P37571	CLPC_BACSU	Negative regulator of genetic competence ClpC/MecB	clpC mecB BSU00860	90119	P37958	
P37575	SP2B_BACSU	Stage II sporulation protein B	spoIIB BSU28060	35923		
P37580	FHUD_BACSU	Iron(3+)-hydroxamate-binding protein FhuD (Ferric hydroxamate uptake protein D) (Ferrichrome-binding protein) (Iron(III)-hydroxamate-binding protein FhuD)	fhuD BSU33320	34426		SUBUNIT: The complex is composed of an ATP-binding protein (FhuC), two transmembrane proteins (FhuB and FhuG) and a solute-binding protein (FhuD or YxeB). {ECO:0000250}.
P37584	CSAA_BACSU	Probable chaperone CsaA	csaA BSU19040	11907		SUBUNIT: Homodimer (PubMed:17372352). Probably binds SecA and prePhoB (PubMed:10816431). Probably interacts with proSdpC (PubMed:13129613). {ECO:0000269|PubMed:10816431, ECO:0000269|PubMed:13129613, ECO:0000269|PubMed:17372352}.
P37585	MURG_BACSU	UDP-N-acetylglucosamine--N-acetylmuramyl-(pentapeptide) pyrophosphoryl-undecaprenol N-acetylglucosamine transferase (EC 2.4.1.227) (Undecaprenyl-PP-MurNAc-pentapeptide-UDPGlcNAc GlcNAc transferase)	murG BSU15220	39936		
P37810	ATPG_BACSU	ATP synthase gamma chain (ATP synthase F1 sector gamma subunit) (F-ATPase gamma subunit)	atpG BSU36820	31655		SUBUNIT: F-type ATPases have 2 components, CF(1) - the catalytic core - and CF(0) - the membrane proton channel. CF(1) has five subunits: alpha(3), beta(3), gamma(1), delta(1), epsilon(1). CF(0) has three main subunits: a, b and c (Probable). The F(1)F(0) complex interacts with SpoIIIJ and YqjG; YqgA is found in the same complex (By similarity) (PubMed:19717609). Interacts with FloT (PubMed:23651456). {ECO:0000255|HAMAP-Rule:MF_00815, ECO:0000269|PubMed:19717609, ECO:0000269|PubMed:23651456, ECO:0000305}.
P37811	ATPD_BACSU	ATP synthase subunit delta (ATP synthase F(1) sector subunit delta) (F-type ATPase subunit delta) (F-ATPase subunit delta)	atpH BSU36840	19982		SUBUNIT: F-type ATPases have 2 components, F(1) - the catalytic core - and F(0) - the membrane proton channel. F(1) has five subunits: alpha(3), beta(3), gamma(1), delta(1), epsilon(1). F(0) has three main subunits: a(1), b(2) and c(10-14). The alpha and beta chains form an alternating ring which encloses part of the gamma chain. F(1) is attached to F(0) by a central stalk formed by the gamma and epsilon chains, while a peripheral stalk is formed by the delta and b chains (Probable). The F(1)F(0) complex interacts with SpoIIIJ and YqjG; YqgA is found in the same complex (By similarity) (PubMed:19717609) (Probable). Interacts with FloT (PubMed:23651456). {ECO:0000255|HAMAP-Rule:MF_01416, ECO:0000269|PubMed:19717609, ECO:0000269|PubMed:23651456, ECO:0000305}.
P37812	ATPE_BACSU	ATP synthase epsilon chain (ATP synthase F1 sector epsilon subunit) (F-ATPase epsilon subunit)	atpC BSU36800	14209		SUBUNIT: F-type ATPases have 2 components, CF(1) - the catalytic core - and CF(0) - the membrane proton channel. CF(1) has five subunits: alpha(3), beta(3), gamma(1), delta(1), epsilon(1). CF(0) has three main subunits: a, b and c (Probable). The F(1)F(0) complex interacts with SpoIIIJ and YqjG; YqgA is found in the same complex. {ECO:0000269|PubMed:19717609, ECO:0000305}.
P37813	ATP6_BACSU	ATP synthase subunit a (ATP synthase F0 sector subunit a) (F-ATPase subunit 6)	atpB BSU36870	27054		SUBUNIT: F-type ATPases have 2 components, CF(1) - the catalytic core - and CF(0) - the membrane proton channel. CF(1) has five subunits: alpha(3), beta(3), gamma(1), delta(1), epsilon(1). CF(0) has three main subunits: a(1), b(2) and c(9-12). The alpha and beta chains form an alternating ring which encloses part of the gamma chain. CF(1) is attached to CF(0) by a central stalk formed by the gamma and epsilon chains, while a peripheral stalk is formed by the delta and b chains (Probable). The F(1)F(0) complex interacts with SpoIIIJ and YqjG; YqgA is found in the same complex. {ECO:0000255|HAMAP-Rule:MF_01393, ECO:0000269|PubMed:19717609, ECO:0000305}.
P37814	ATPF_BACSU	ATP synthase subunit b (ATP synthase F(0) sector subunit b) (ATPase subunit I) (F-type ATPase subunit b) (F-ATPase subunit b)	atpF BSU36850	19208		SUBUNIT: F-type ATPases have 2 components, F(1) - the catalytic core - and F(0) - the membrane proton channel. F(1) has five subunits: alpha(3), beta(3), gamma(1), delta(1), epsilon(1). F(0) has three main subunits: a(1), b(2) and c(10-14). The alpha and beta chains form an alternating ring which encloses part of the gamma chain. F(1) is attached to F(0) by a central stalk formed by the gamma and epsilon chains, while a peripheral stalk is formed by the delta and b chains (Probable). The F(1)F(0) complex interacts with SpoIIIJ and YqjG; YqgA is found in the same complex. {ECO:0000255|HAMAP-Rule:MF_01398, ECO:0000269|PubMed:19717609, ECO:0000305}.
P37815	ATPL_BACSU	ATP synthase subunit c (ATP synthase F(0) sector subunit c) (F-type ATPase subunit c) (F-ATPase subunit c) (Lipid-binding protein)	atpE BSU36860	7094		SUBUNIT: F-type ATPases have 2 components, F(1) - the catalytic core - and F(0) - the membrane proton channel. F(1) has five subunits: alpha(3), beta(3), gamma(1), delta(1), epsilon(1). F(0) has three main subunits: a(1), b(2) and c(10-14). The alpha and beta chains form an alternating ring which encloses part of the gamma chain. F(1) is attached to F(0) by a central stalk formed by the gamma and epsilon chains, while a peripheral stalk is formed by the delta and b chains (Probable). The F(1)F(0) complex interacts with SpoIIIJ and YqjG; YqgA is found in the same complex. {ECO:0000255|HAMAP-Rule:MF_01396, ECO:0000269|PubMed:19717609, ECO:0000305}.
P37940	ODBA_BACSU	2-oxoisovalerate dehydrogenase subunit alpha (EC 1.2.4.4) (Branched-chain alpha-keto acid dehydrogenase E1 component alpha chain) (BCKDH E1-alpha)	bfmBAA bfmB1a BSU24050	36334		SUBUNIT: Heterotetramer of two alpha and two beta chains. Directly associated with ODBB in the E1 complex.
P37941	ODBB_BACSU	2-oxoisovalerate dehydrogenase subunit beta (EC 1.2.4.4) (Branched-chain alpha-keto acid dehydrogenase E1 component beta chain) (BCKDH E1-beta)	bfmBAB bfmB1b BSU24040	35856		SUBUNIT: Heterotetramer of two alpha and two beta chains. Directly associated with ODBA in the E1 complex.
P37944	AROK_BACSU	Shikimate kinase (SK) (EC 2.7.1.71)	aroK aroI BSU03150	21923		SUBUNIT: Monomer. {ECO:0000255|HAMAP-Rule:MF_00109}.
P37946	ILVA_BACSU	L-threonine dehydratase biosynthetic IlvA (EC 4.3.1.19) (Threonine deaminase)	ilvA BSU21770	46701		SUBUNIT: Homotetramer. {ECO:0000250}.
P37948	GLPT_BACSU	Glycerol-3-phosphate transporter (G-3-P transporter) (G-3-P permease)	glpT ybeE BSU02140	49802		
P37949	LEPA_BACSU	Elongation factor 4 (EF-4) (EC 3.6.5.n1) (Ribosomal back-translocase LepA)	lepA yqeQ yqxB BSU25510	68587		
P37954	UVRB_BACSU	UvrABC system protein B (Protein UvrB) (Excinuclease ABC subunit B) (Protein DinA)	uvrB dinA uvr BSU35170	76327		SUBUNIT: Forms a heterotetramer with UvrA during the search for lesions. Interacts with UvrC in an incision complex. {ECO:0000255|HAMAP-Rule:MF_00204}.
P37958	MECA1_BACSU	Adapter protein MecA 1	mecA BSU11520	25764	P37571	SUBUNIT: Homodimer. {ECO:0000269|PubMed:10447896}.
P37963	SP6D_BACSU	Stage VI sporulation protein D	spoVID BSU28110	64977	P14016	
P38033	NIFS_BACSU	Putative cysteine desulfurase NifS (EC 2.8.1.7)	nifS iscS BSU27880	43786		
P38422	DACF_BACSU	D-alanyl-D-alanine carboxypeptidase DacF (DD-carboxypeptidase) (DD-peptidase) (EC 3.4.16.4) (Penicillin-binding protein DacF) (PBP)	dacF BSU23480	43297		
P38490	YPEB_BACSU	Sporulation protein YpeB (PSPA12)	ypeB joeB yzuA BSU22920	51185		
P38493	KCY_BACSU	Cytidylate kinase (CK) (EC 2.7.4.25) (Cytidine monophosphate kinase) (CMP kinase)	cmk jofC ypfC BSU22890	25096		
P38494	RS1H_BACSU	Small ribosomal subunit protein bS1 homolog (30S ribosomal protein S1 homolog)	ypfD jofD BSU22880	42402		
P39071	DHBA_BACSU	2,3-dihydro-2,3-dihydroxybenzoate dehydrogenase (EC 1.3.1.28) (Cold shock protein CSI14)	dhbA entA BSU32000	27454		
P39074	BMRU_BACSU	Putative lipid kinase BmrU (EC 2.7.1.-)	bmrU BSU24000	32441		
P39075	BMRR_BACSU	Multidrug-efflux transporter 1 regulator	bmrR bmr1R BSU24020	32582		SUBUNIT: Binds DNA as a homodimer.
P39119	CISY_BACSU	Citrate synthase 1 (EC 2.3.3.16) (Citrate synthase I)	citA BSU09440	40952		SUBUNIT: Homodimer. {ECO:0000250}.
P39121	DEOC_BACSU	Deoxyribose-phosphate aldolase (DERA) (EC 4.1.2.4) (2-deoxy-D-ribose 5-phosphate aldolase) (Phosphodeoxyriboaldolase) (Deoxyriboaldolase)	deoC dra BSU39420	23261		
P39122	GLGC_BACSU	Glucose-1-phosphate adenylyltransferase (EC 2.7.7.27) (ADP-glucose pyrophosphorylase) (ADPGlc PPase) (ADP-glucose synthase)	glgC BSU30970	42603		SUBUNIT: Homotetramer. {ECO:0000255|HAMAP-Rule:MF_00624}.
P39123	PHSG_BACSU	Glycogen phosphorylase (EC 2.4.1.1)	glgP BSU30940	91756		
P39125	GLGA_BACSU	Glycogen synthase (EC 2.4.1.21) (Starch [bacterial glycogen] synthase)	glgA BSU30950	55857		
P39127	CITR_BACSU	HTH-type transcriptional regulator CitR (Citrate synthase I repressor)	citR BSU09430	33667		
P39131	MNAA_BACSU	UDP-N-acetylglucosamine 2-epimerase (EC 5.1.3.14) (UDP-GlcNAc-2-epimerase)	mnaA BSU35660	42634		
P39137	ROCE_BACSU	Amino-acid permease RocE	rocE BSU40330	51634		
P39140	DEOR_BACSU	Deoxyribonucleoside regulator	deoR yxxC BSU39430	35253	P39140	SUBUNIT: Homooctamer. {ECO:0000269|PubMed:10714997}.
P39143	GUTR_BACSU	Transcription activator GutR	gutR BSU06140	95076		
P39149	UPP_BACSU	Uracil phosphoribosyltransferase (EC 2.4.2.9) (UMP pyrophosphorylase) (UPRTase)	upp BSU36890 ipc-35d	23037		
P39211	XYLB_BACSU	Xylulose kinase (Xylulokinase) (EC 2.7.1.17)	xylB yncA BSU17610	55417		
P39216	TLPA_BACSU	Methyl-accepting chemotaxis protein TlpA	tlpA BSU31250	72278		
P39217	TLPB_BACSU	Methyl-accepting chemotaxis protein TlpB	tlpB BSU31230	71536		
P39456	TCYC_BACSU	L-cystine import ATP-binding protein TcyC (EC 7.4.2.-)	tcyC yckI BSU03590	27748		SUBUNIT: The complex is composed of two ATP-binding proteins (TcyC), two transmembrane proteins (TcyB) and a solute-binding protein (TcyA). {ECO:0000305}.
P39574	GAL1_BACSU	Galactokinase (EC 2.7.1.6) (Galactose kinase)	galK BSU38200 ipa-35d	43521		
P39579	DLTC_BACSU	D-alanyl carrier protein (DCP) (D-alanine--poly(phosphoribitol) ligase subunit 2)	dltC BSU38520 ipa-3r	9009		
P39581	DLTA_BACSU	D-alanine--D-alanyl carrier protein ligase (DCL) (EC 6.2.1.54) (D-alanine--poly(phosphoribitol) ligase subunit 1) (D-alanine-activating enzyme) (DAE)	dltA dae BSU38500 ipa-5r	55809		
P39582	MENA_BACSU	1,4-dihydroxy-2-naphthoate octaprenyltransferase (DHNA-octaprenyltransferase) (EC 2.5.1.74)	menA ywaB BSU38490 ipa-6d	33838		
P39603	YWCE_BACSU	Spore morphogenesis and germination protein YwcE	ywcE BSU38130 ipa-41r	9959		
P39615	UNG_BACSU	Uracil-DNA glycosylase (UDG) (EC 3.2.2.27)	ung ywdG BSU37970 ipa-57d	26047		SUBUNIT: Interacts with bacillus phage phi29 protein p56; this interaction inhibits the uracil-DNA glycosylase. {ECO:0000269|PubMed:17698500}.
P39621	SPSA_BACSU	Spore coat polysaccharide biosynthesis protein SpsA	spsA BSU37910 ipa-63d	30184		SUBUNIT: Monomer in solution.
P39629	RMLA_BACSU	Glucose-1-phosphate thymidylyltransferase (EC 2.7.7.24) (Spore coat polysaccharide biosynthesis protein SpsI) (dTDP-glucose pyrophosphorylase) (dTDP-glucose synthase)	rmlA spsI BSU37840 ipa-71d	27773		
P39630	RMLB_BACSU	dTDP-glucose 4,6-dehydratase (EC 4.2.1.46) (Spore coat polysaccharide biosynthesis protein SpsJ)	rfbB spsJ BSU37830 ipa-72d	35539		SUBUNIT: Homodimer. {ECO:0000250|UniProtKB:P27830}.
P39632	BSLB_BACSU	Probable biofilm-surface layer protein B	bslB yweA BSU37800 ipa-74d	16687		SUBUNIT: Monomer in vitro. {ECO:0000269|PubMed:28751732}.
P39638	BACA_BACSU	Prephenate decarboxylase (EC 4.1.1.100) (Bacilysin biosynthesis protein BacA) (Non-aromatizing prephenate decarboxylase)	bacA ywfB BSU37740 ipa-80d	23326		
P39646	PTAS_BACSU	Phosphate acetyltransferase (EC 2.3.1.8) (Phosphotransacetylase) (Vegetative protein 43) (VEG43)	pta ywfJ BSU37660 ipa-88d	34791		
P39647	CYSL_BACSU	HTH-type transcriptional regulator CysL (CysJI operon transcriptional activator)	cysL ywfK BSU37650 ipa-89d	34190		
P39650	RSFA_BACSU	Prespore-specific transcriptional regulator RsfA	rsfA ywfN BSU37620 ipa-92r	29728		
P39666	NADC_BACSU	Probable nicotinate-nucleotide pyrophosphorylase [carboxylating] (EC 2.4.2.19) (General stress protein 70) (GSP70) (Quinolinate phosphoribosyltransferase [decarboxylating]) (QAPRTase)	nadC yrxB BSU27860	31393		SUBUNIT: Hexamer formed by 3 homodimers. {ECO:0000250}.
P39667	NADR_BACSU	Transcription repressor NadR (ORF1)	nadR niaR yrxA BSU27890	19928		SUBUNIT: Homodimer. {ECO:0000269|PubMed:18276644}.
P39694	COMEA_BACSU	ComE operon protein 1	comEA comE1 BSU25590	21769		
P39695	COMEC_BACSU	ComE operon protein 3	comEC comE3 BSU25570	86701		
P39738	FLID_BACSU	Flagellar hook-associated protein 2 (HAP2) (Filament cap protein) (Flagellar cap protein)	fliD mrgB BSU35340	54505	P39740	SUBUNIT: Homopentamer. {ECO:0000250}.
P39739	FLIS_BACSU	Flagellar secretion chaperone FliS	fliS BSU35330	15131		SUBUNIT: Homodimer (PubMed:16021622, PubMed:23144244). Interacts directly with flagellin (hag), forms a 3-way complex of Hag, FliS and FliW in which Flis and FliW do not directly interact (PubMed:23144244). {ECO:0000269|PubMed:23144244, ECO:0000305|PubMed:16021622}.
P39760	KTRC_BACSU	Ktr system potassium uptake protein C (K(+)-uptake protein KtrC) (ORF4)	ktrC ykqB ylxV yzaC BSU14510	24348		SUBUNIT: Homodimer, tetramer (dimer of homodimer) and octamer (tetramer of homodimer). Part of the KtrCD complex formed by an octameric catalytic ring of KtrC and a membrane associated dimer of KtrD forming a potassium channel (By similarity). {ECO:0000250}.
P39775	OPUBD_BACSU	Choline transport system permease protein OpuBD	opuBD proZ BSU33700	23928		
P39776	XERC_BACSU	Tyrosine recombinase XerC	xerC codV BSU16140	35342		SUBUNIT: Forms a cyclic heterotetrameric complex composed of two molecules of XerC and two molecules of XerD. {ECO:0000255|HAMAP-Rule:MF_01808}.
P39778	CLPY_BACSU	ATP-dependent protease ATPase subunit ClpY	clpY codX hslU BSU16160	52586		SUBUNIT: A double ring-shaped homohexamer of ClpQ is capped on each side by a ring-shaped ClpY homohexamer. The assembly of the ClpQ/ClpY complex is dependent on binding of ATP (By similarity). {ECO:0000250}.
P39788	END3_BACSU	Endonuclease III (EC 4.2.99.18) (DNA-(apurinic or apyrimidinic site) lyase)	nth jooB ypoB BSU22340	25000		
P39790	MPR_BACSU	Extracellular metalloprotease (EC 3.4.21.-)	mpr BSU02240	33842		SUBUNIT: Monomer.
P39794	PTTBC_BACSU	PTS system trehalose-specific EIIBC component (EIIBC-Tre) (EII-Tre) [Includes: Trehalose-specific phosphotransferase enzyme IIB component (EC 2.7.1.201) (PTS system trehalose-specific EIIB component); Trehalose permease IIC component (PTS system trehalose-specific EIIC component)]	treP treB BSU07800	50000		
P39796	TRER_BACSU	HTH-type transcriptional regulator TreR (Trehalose operon repressor)	treR yfxA BSU07820	27842		SUBUNIT: Dimer of dimers. {ECO:0000269|PubMed:17705272}.
P39800	XLYA_BACSU	N-acetylmuramoyl-L-alanine amidase XlyA (EC 3.5.1.28) (Autolysin) (Cell wall hydrolase)	xlyA BSU12810	31913		
P39802	CHEW_BACSU	Chemotaxis protein CheW (Coupling protein CheW)	cheW BSU16440	17505		
P39815	TRMFO_BACSU	Methylenetetrahydrofolate--tRNA-(uracil-5-)-methyltransferase TrmFO (EC 2.1.1.74) (Folate-dependent tRNA (uracil-5-)-methyltransferase) (Folate-dependent tRNA(M-5-U54)-methyltransferase)	trmFO gid ylyC BSU16130	48063		SUBUNIT: Homodimer. {ECO:0000305|PubMed:16027442}.
P39817	GLTP_BACSU	Proton/glutamate-aspartate symporter (Proton/glutamate symport protein)	gltP BSU02340	44615		
P39820	PROB_BACSU	Glutamate 5-kinase 1 (EC 2.7.2.11) (Gamma-glutamyl kinase 1) (GK 1)	proB BSU13120	39346		
P39821	PROA_BACSU	Gamma-glutamyl phosphate reductase (GPR) (EC 1.2.1.41) (Glutamate-5-semialdehyde dehydrogenase) (Glutamyl-gamma-semialdehyde dehydrogenase) (GSA dehydrogenase)	proA BSU13130	45252		
P39823	PSS_BACSU	CDP-diacylglycerol--serine O-phosphatidyltransferase (EC 2.7.8.8) (Phosphatidylserine synthase)	pssA pss BSU02270	19613		
P39824	BLAC_BACSU	Beta-lactamase (EC 3.5.2.6) (Penicillinase)	penP BSU18800	33446		
P39840	GALM_BACSU	Aldose 1-epimerase (EC 5.1.3.3) (Galactose mutarotase)	galM yoxA BSU18360	37228		
P39841	MANA3_BACSU	Putative mannose-6-phosphate isomerase YvyI (EC 5.3.1.8) (Phosphohexomutase) (Phosphomannose isomerase) (PMI)	yvyI pmi BSU35790	35428		
P39843	BMR2_BACSU	Multidrug resistance protein 2 (Multidrug-efflux transporter 2)	blt bmr2 bmt BSU26590	43424		
P39845	PPSA_BACSU	Plipastatin synthase subunit A (EC 2.3.1.-) (Peptide synthase 1) [Includes: ATP-dependent glutamate adenylase 1 (GluA 1) (Glutamate activase 1); ATP-dependent ornithine adenylase (OrnA) (Ornithine activase)]	ppsA pps1 BSU18340	289185		
P39846	PPSB_BACSU	Plipastatin synthase subunit B (EC 2.3.1.-) (Peptide synthase 2) [Includes: ATP-dependent tyrosine adenylase 1 (TyrA 1) (Tyrosine activase 1); ATP-dependent threonine adenylase (ThrA) (Threonine activase)]	ppsB pps2 BSU18330	290165		
P39847	PPSC_BACSU	Plipastatin synthase subunit C (EC 2.3.1.-) (Peptide synthase 3) [Includes: ATP-dependent glutamate adenylase 2 (GluA 2) (Glutamate activase 2); ATP-dependent alanine/valine adenylase (Ala/ValA) (Alanine/valine activase)]	ppsC pps3 BSU18320	287503		
P39912	AROG_BACSU	Protein AroA(G) [Includes: Phospho-2-dehydro-3-deoxyheptonate aldolase (EC 2.5.1.54) (3-deoxy-D-arabino-heptulosonate 7-phosphate synthase) (DAHP synthase) (Phospho-2-keto-3-deoxyheptonate aldolase); Chorismate mutase (EC 5.4.99.5)]	aroA BSU29750	39539		
P40396	COMK_BACSU	Competence transcription factor (CTF) (Competence protein K)	comK BSU10420	22430		
P40399	RSBU_BACSU	Phosphoserine phosphatase RsbU (EC 3.1.3.3) (Sigma factor SigB regulation protein RsbU)	rsbU BSU04700	38631		
P40400	SSUA_BACSU	Putative aliphatic sulfonates-binding protein	ssuA ygbA yzeA BSU08840	36336		
P40401	SSUC_BACSU	Putative aliphatic sulfonates transport permease protein SsuC	ssuC ygaM yzeB BSU08850	30240		
P40403	CHEC_BACSU	CheY-P phosphatase CheC (EC 3.-.-.-)	cheC ylxJ BSU16450	23049		SUBUNIT: Forms a complex with CheD.
P40404	CHED_BACSU	Chemoreceptor glutamine deamidase CheD (EC 3.5.1.44)	cheD ylxK BSU16460	18008		SUBUNIT: Forms a complex with CheC.
P40408	BTR_BACSU	HTH-type transcriptional activator Btr (Bacillibactin transport regulator)	btr ybbB yzbC BSU01640	60763		SUBUNIT: Binds with high affinity to both apo-bacillibactin and iron-bacillibactin.
P40410	FEUB_BACSU	Iron-uptake system permease protein FeuB	feuB BSU01620	35897		SUBUNIT: The complex is composed of one ATP-binding protein (YusV), two transmembrane proteins (FeuB and FeuC) and a solute-binding protein (FeuA). {ECO:0000305}.
P40411	FEUC_BACSU	Iron-uptake system permease protein FeuC	feuC BSU01610	36090		SUBUNIT: The complex is composed of one ATP-binding protein (YusV), two transmembrane proteins (FeuB and FeuC) and a solute-binding protein (FeuA). {ECO:0000305}.
P40735	ECFA1_BACSU	Energy-coupling factor transporter ATP-binding protein EcfA1 (ECF transporter A component EcfA) (EC 7.-.-.-)	ecfA cbiO1 ybaD ybxA BSU01450	31459		SUBUNIT: Forms a stable energy-coupling factor (ECF) transporter complex composed of 2 membrane-embedded substrate-binding proteins (S component), 2 ATP-binding proteins (A component) and 2 transmembrane proteins (T component). {ECO:0000255|HAMAP-Rule:MF_01710}.
P40739	PTV3B_BACSU	PTS system beta-glucoside-specific EIIBCA component (EIIBCA-Bgl) (EII-Bgl) [Includes: Beta-glucoside-specific phosphotransferase enzyme IIB component (EC 2.7.1.-) (PTS system beta-glucoside-specific EIIB component); Beta-glucoside permease IIC component (PTS system beta-glucoside-specific EIIC component); Beta-glucoside-specific phosphotransferase enzyme IIA component (PTS system beta-glucoside-specific EIIA component)]	bglP BSU39270 N17C	64478		
P40740	BGLH_BACSU	Aryl-phospho-beta-D-glucosidase BglH (EC 3.2.1.86) (6-phospho-beta-glucosidase)	bglH BSU39260 N17D	53289		
P40742	YLXH_BACSU	Flagellum site-determining protein YlxH	ylxH BSU16410	33161	Q01960	SUBUNIT: Interacts (via N-terminal region) with GTP-bound FlhF homodimer (via NG domain). {ECO:0000269|PubMed:22056770}.
P40746	TGL_BACSU	Protein-glutamine gamma-glutamyltransferase (EC 2.3.2.13) (Transglutaminase) (TGase)	tgl yugV yuxF BSU31270	28296		
