Entry	Entry Name	Protein names	Gene Names	Mass	Interacts with	Subunit structure
O34572	YKOC_BACSU	Putative HMP/thiamine permease protein YkoC	ykoC BSU13210	28042		SUBUNIT: The complex is composed of two ATP-binding proteins (YkoD), two transmembrane proteins (YkoC and YkoE) and a solute-binding protein (YkoF). {ECO:0000305}.
O34573	YFKT_BACSU	Putative spore germination protein YfkT	yfkT BSU07760	40357		
O34574	YEFB_BACSU	Uncharacterized protein YefB	yefB BSU06740	35046		
O34575	YKCB_BACSU	Putative mannosyltransferase YkcB (EC 2.4.1.-)	ykcB BSU12880	76342		
O34581	YOQL_BACSU	SPbeta prophage-derived putative HNH endonuclease YoqL (EC 3.1.-.-)	yoqL BSU20590	27592		
O34586	YLBC_BACSU	Uncharacterized membrane protein YlbC	ylbC BSU14960	39632		
O34589	FLAW_BACSU	Probable flavodoxin 2	ykuP BSU14170	16643		
O34591	ACOB_BACSU	Acetoin:2,6-dichlorophenolindophenol oxidoreductase subunit beta (Acetoin:DCPIP oxidoreductase-beta) (Ao:DCPIP OR) (EC 1.1.1.-) (TPP-dependent acetoin dehydrogenase E1 subunit beta)	acoB yfjJ BSU08070	36845		SUBUNIT: Tetramer of 2 alpha and 2 beta subunits. {ECO:0000250}.
O34592	YDJP_BACSU	AB hydrolase superfamily protein YdjP (EC 3.-.-.-)	ydjP BSU06280	30509		
O34597	YFKL_BACSU	Uncharacterized MFS-type transporter YfkL	yfkL BSU07860	42169		
O34606	GLNP_BACSU	Probable glutamine ABC transporter permease protein GlnP	glnP BSU27460	24165		SUBUNIT: The complex is composed of two ATP-binding proteins (GlnQ), two transmembrane proteins (GlnM and GlnP) and a solute-binding protein (GlnH). {ECO:0000305}.
O34607	SDHAA_BACSU	Probable L-serine dehydratase, alpha chain (SDH) (EC 4.3.1.17) (L-serine deaminase) (L-SD)	sdaAA ylpA BSU15860	30936		SUBUNIT: Heterodimer of an alpha chain and a beta chain. {ECO:0000250}.
O34608	YDIN_BACSU	Uncharacterized protein YdiN	ydiN BSU06050	8405		
O34618	YTNA_BACSU	Uncharacterized amino acid permease YtnA	ytnA BSU30530	50328		
O34619	LMRA_BACSU	HTH-type transcriptional regulator LmrA	lmrA yccB BSU02680	20663		
O34623	DPO3A_BACSU	DNA polymerase III subunit alpha (EC 2.7.7.7)	dnaE BSU29230	125350		SUBUNIT: DNA polymerase III contains a core (composed of alpha, epsilon and theta chains) that associates with a tau subunit. This core dimerizes to form the PolIII' complex. PolIII' associates with the gamma complex (composed of gamma, delta, delta', psi and chi chains) and with the beta chain to form the complete DNA polymerase III complex (By similarity). {ECO:0000250}.
O34624	YEBE_BACSU	UPF0316 protein YebE	yebE yebF BSU06400	20667		
O34629	YERH_BACSU	Uncharacterized lipoprotein YerH	yerH BSU06630	44517		
O34631	YVRA_BACSU	Uncharacterized ABC transporter ATP-binding protein YvrA (EC 7.-.-.-)	yvrA BSU33160	48632		SUBUNIT: The complex is composed of two ATP-binding proteins (YvrA), two transmembrane proteins (YvrB) and a solute-binding protein (YvrC). {ECO:0000305}.
O34643	YVKB_BACSU	Uncharacterized HTH-type transcriptional regulator YvkB	yvkB BSU35200	21534		
O34647	YOBD_BACSU	Uncharacterized HTH-type transcriptional regulator YobD	yobD BSU18850	12967		
O34649	YTLD_BACSU	Uncharacterized ABC transporter permease protein YtlD	ytlD BSU30620	30305		
O34656	COTI_BACSU	Spore coat protein I	cotI ytaA BSU30920	41245		
O34662	YODT_BACSU	Uncharacterized aminotransferase YodT (EC 2.6.-.-)	yodT yokM BSU19740	48413		
O34663	YBCL_BACSU	Uncharacterized MFS-type transporter YbcL	ybcL BSU01890	41409		
O34669	YOCH_BACSU	Cell wall-binding protein YocH	yocH BSU19210	30182		
O34671	GLNM_BACSU	Probable glutamine ABC transporter permease protein GlnM	glnM BSU27450	23701		SUBUNIT: The complex is composed of two ATP-binding proteins (GlnQ), two transmembrane proteins (GlnM and GlnP) and a solute-binding protein (GlnH). {ECO:0000305}.
O34672	YDIM_BACSU	Uncharacterized protein YdiM	ydiM BSU06040	13831		
O34673	UXAA_BACSU	Altronate dehydratase (EC 4.2.1.7) (D-altronate hydro-lyase)	uxaA yjmJ BSU12390	54872		
O34678	YTBE_BACSU	Uncharacterized oxidoreductase YtbE (EC 1.-.-.-)	ytbE BSU29050	31768		
O34683	HIS7_BACSU	Imidazoleglycerol-phosphate dehydratase (IGPD) (EC 4.2.1.19)	hisB BSU34900	21549		
O34686	YVRL_BACSU	Membrane-bound negative regulator YvrL	yvrL BSU33250	15360		
O34687	RL32_BACSU	Large ribosomal subunit protein bL32 (50S ribosomal protein L32)	rpmF BSU15080	6729		SUBUNIT: Part of the 50S ribosomal subunit. {ECO:0000269|PubMed:30126986}.
O34688	DABA_BACSU	Probable inorganic carbon transporter subunit DabA	dabA ybcC BSU01845 BSU01840	98767		SUBUNIT: Forms a complex with DabB. {ECO:0000255|HAMAP-Rule:MF_01871}.
O34692	YVNA_BACSU	Uncharacterized HTH-type transcriptional regulator YvnA	yvnA BSU35050	18244		
O34694	YTAB_BACSU	Uncharacterized membrane protein YtaB	ytaB BSU30930	17289		
O34701	YOAU_BACSU	Uncharacterized HTH-type transcriptional regulator YoaU	yoaU BSU18760	32580		
O34707	YTPB_BACSU	Tetraprenyl-beta-curcumene synthase (EC 4.2.3.130)	ytpB BSU30500	42843		
O34708	YFLA_BACSU	Uncharacterized transporter YflA	yflA BSU07750	50641		
O34712	YTRA_BACSU	HTH-type transcriptional repressor YtrA	ytrA BSU30460	14694		
O34724	YCEJ_BACSU	Uncharacterized MFS-type transporter YceJ	yceJ BSU02960	41962		
O34725	YJHA_BACSU	Uncharacterized lipoprotein YjhA	yjhA BSU12180	23978		
O34726	YFLS_BACSU	Putative malate transporter YflS	yflS BSU07570	51432		
O34731	YLBK_BACSU	Uncharacterized NTE family protein YlbK	ylbK BSU15040	28258		
O34736	YJMC_BACSU	Uncharacterized oxidoreductase YjmC (EC 1.1.1.-)	yjmC BSU12320	36471		
O34737	FLAV_BACSU	Probable flavodoxin 1	ykuN BSU14150	17793		
O34738	YKOE_BACSU	Putative HMP/thiamine permease protein YkoE	ykoE BSU13230	21224		SUBUNIT: The complex is composed of two ATP-binding proteins (YkoD), two transmembrane proteins (YkoC and YkoE) and a solute-binding protein (YkoF). {ECO:0000305}.
O34745	YODF_BACSU	Uncharacterized symporter YodF	yodF BSU19580	53765		
O34751	YLOV_BACSU	Protein YloV	yloV BSU15840	59497		
O34755	YKOT_BACSU	Uncharacterized glycosyltransferase YkoT (EC 2.4.-.-)	ykoT BSU13390	38515	P71012; O31501	
O34756	YJKB_BACSU	Putative ABC transporter ATP-binding protein YjkB	yjkB BSU12250	27821		
O34762	OHRA_BACSU	Organic hydroperoxide resistance protein OhrA	ohrA yklA BSU13140	14868		
O34764	SAT1_BACSU	Sulfate adenylyltransferase (EC 2.7.7.4) (ATP-sulfurylase) (Sulfate adenylate transferase) (SAT)	sat ylnB BSU15590	42884		
O34765	YLBJ_BACSU	Sporulation integral membrane protein YlbJ	ylbJ BSU15030	44838		
O34768	YDJE_BACSU	Uncharacterized sugar kinase YdjE (EC 2.7.1.-)	ydjE fruC BSU06170	34256		
O34782	YVRD_BACSU	Uncharacterized oxidoreductase YvrD (EC 1.-.-.-)	yvrD BSU33190	28222		
O34792	YVJA_BACSU	UPF0750 membrane protein YvjA	yvjA BSU35280	29984		
O34796	YVKC_BACSU	Uncharacterized phosphotransferase YvkC	yvkC BSU35190	94448		
O34805	YVRC_BACSU	Uncharacterized ABC transporter substrate-binding lipoprotein YvrC	yvrC BSU33180	34239		SUBUNIT: The complex is composed of two ATP-binding proteins (YvrA), two transmembrane proteins (YvrB) and a solute-binding protein (YvrC). {ECO:0000305}.
O34806	YTFJ_BACSU	Uncharacterized spore protein YtfJ	ytfJ BSU29500	16347		
O34812	YFMJ_BACSU	Putative NADP-dependent oxidoreductase YfmJ (EC 1.-.-.-)	yfmJ BSU07450	36663		
O34815	YOAD_BACSU	Putative 2-hydroxyacid dehydrogenase YoaD (EC 1.1.1.-)	yoaD BSU18560	38630		
O34819	PEL1_BACSU	Pectin lyase (PNL) (EC 4.2.2.10)	pelB BSU18650	38108		
O34823	YBCF_BACSU	Putative carbonic anhydrase-like protein YbcF	ybcF BSU01860	19503		
O34827	YKUM_BACSU	Uncharacterized HTH-type transcriptional regulator YkuM	ykuM BSU14140	33912		
O34829	MELR_BACSU	HTH-type transcriptional repressor MelR	melR msmR BSU30260	38399		
O34832	YFME_BACSU	Fe(3+)-citrate import system permease protein YfmE (Ferric-citrate import system permease protein)	yfmE BSU07500	35219		SUBUNIT: The complex is composed of one ATP-binding protein (YfmF), two transmembrane proteins (YfmD and YfmE) and a solute-binding protein (YfmC). {ECO:0000305}.
O34846	CMOO_BACSU	N-acetyl-S-alkylcysteine monooxygenase (EC 1.14.14.-)	cmoO ytmO BSU29330	36944		
O34849	YERD_BACSU	Glutamate synthase large subunit-like protein YerD	yerD yecE BSU06590	58752		
O34858	ARLY_BACSU	Argininosuccinate lyase (ASAL) (EC 4.3.2.1) (Arginosuccinase)	argH BSU29440	51929		
O34861	YOAC_BACSU	Putative sugar kinase YoaC (EC 2.7.1.-)	yoaC BSU18550	54109		
O34864	YOAB_BACSU	Putative transporter YoaB	yoaB BSU18540	45377		
O34870	YKUE_BACSU	Uncharacterized metallophosphoesterase YkuE	ykuE BSU14050	31615		
O34872	YTIB_BACSU	Putative carbonic anhydrase YtiB (EC 4.2.1.1) (Carbonate dehydratase)	ytiB BSU30690	21111		
O34882	YOLI_BACSU	Probable tautomerase YolI (EC 5.3.2.-)	yolI yodA BSU19530	14605		
O34886	YTCB_BACSU	Uncharacterized UDP-glucose epimerase YtcB (EC 4.-.-.-)	ytcB BSU30870	34912		
O34889	SDPA_BACSU	Sporulation-delaying protein SdpA	sdpA yvaW BSU33750	18651		
O34896	UXUB_BACSU	Uncharacterized oxidoreductase UxuB (EC 1.-.-.-)	uxuB yjmF BSU12350	29481		
O34898	YTRC_BACSU	Probable ABC transporter permease YtrC	ytrC BSU30440	36951		SUBUNIT: The complex is composed of 2 ATP-binding proteins (YtrB and YtrE), 2 transmembrane proteins (YtrC and YtrD) and a solute-binding protein (YtrF). {ECO:0000305}.
O34901	YOBQ_BACSU	Uncharacterized HTH-type transcriptional regulator YobQ	yobQ BSU19050	28259		
O34909	YERA_BACSU	Putative adenine deaminase YerA (Adenase) (Adenine aminase) (EC 3.5.4.2)	yerA yecB BSU06560	66646		
O34910	YOBT_BACSU	Uncharacterized protein YobT (EC 3.-.-.-)	yobT BSU19080	25397		
O34911	YKOF_BACSU	Putative HMP/thiamine-binding protein YkoF	ykoF BSU13240	22024		SUBUNIT: Homodimer in vitro. In vivo, may be a part of an ABC transporter complex which is composed of two ATP-binding proteins (YkoD), two transmembrane proteins (YkoC and YkoE) and a solute-binding protein (YkoF) (Probable). {ECO:0000305|PubMed:15451668, ECO:0000305|Ref.6}.
O34918	YOAJ_BACSU	Expansin-YoaJ (EXLX1)	yoaJ BSU18630	25638		
O34920	YOBV_BACSU	Uncharacterized HTH-type transcriptional regulator YobV	yobV BSU19100	36536		
O34924	YTOP_BACSU	Putative aminopeptidase YtoP (EC 3.4.11.-)	ytoP BSU29860	39237		
O34929	YFKF_BACSU	Uncharacterized MFS-type transporter YfkF	yfkF BSU07910	42691		
O34933	YFMD_BACSU	Fe(3+)-citrate import system permease protein YfmD (Ferric-citrate import system permease protein)	yfmD BSU07510	35099		SUBUNIT: The complex is composed of one ATP-binding protein (YfmF), two transmembrane proteins (YfmD and YfmE) and a solute-binding protein (YfmC). {ECO:0000305}.
O34940	YVRE_BACSU	Putative sugar lactone lactonase YvrE (EC 3.1.1.-)	yvrE BSU33200	33204		
O34944	PEPVL_BACSU	Putative dipeptidase YtjP (EC 3.4.13.-)	ytjP BSU29980	51053		
O34947	YOAZ_BACSU	Uncharacterized protease YoaZ (EC 3.2.-.-)	yoaZ BSU18790	23420		
O34949	YKOM_BACSU	Uncharacterized HTH-type transcriptional regulator YkoM	ykoM BSU13340	17858		
O34953	YTRD_BACSU	Probable ABC transporter permease YtrD	ytrD BSU30430	36435		SUBUNIT: The complex is composed of 2 ATP-binding proteins (YtrB and YtrE), 2 transmembrane proteins (YtrC and YtrD) and a solute-binding protein (YtrF). {ECO:0000305}.
O34954	YODH_BACSU	Uncharacterized methyltransferase YodH (EC 2.1.1.-)	yodH yolB BSU19600	26069		
O34961	YJMB_BACSU	Uncharacterized symporter YjmB	yjmB BSU12310	50421		
O34969	YFJR_BACSU	Uncharacterized oxidoreductase YfjR (EC 1.1.-.-)	yfjR BSU07990	30474		
O34970	YTTP_BACSU	Probable HTH-type transcriptional regulator YttP (Stress response protein YttP)	yttP BSU29630	24388		
O34973	YTAP_BACSU	Putative hydrolase YtaP (EC 3.-.-.-)	ytaP BSU30250	33777		
O34977	YTHP_BACSU	Uncharacterized ABC transporter ATP-binding protein YthP (EC 7.-.-.-)	ythP BSU30010	26507		
O34978	PBUO_BACSU	Guanine/hypoxanthine permease PbuO	pbuO ytiP BSU29990	45420		
O34979	YVRO_BACSU	Uncharacterized ABC transporter ATP-binding protein YvrO (EC 7.-.-.-)	yvrO BSU33270	25478		
O34983	YOAP_BACSU	Uncharacterized N-acetyltransferase YoaP (EC 2.3.1.-)	yoaP BSU18690	28855		
O34984	YODQ_BACSU	Uncharacterized metallohydrolase YodQ (EC 3.-.-.-)	yodQ argE yokP BSU19710	48555		
O34991	YTVI_BACSU	Putative transport protein YtvI	ytvI BSU29160	40602		
O35004	YDJH_BACSU	UPF0603 protein YdjH	ydjH BSU06200	28163		
O35006	HIS4_BACSU	1-(5-phosphoribosyl)-5-[(5-phosphoribosylamino)methylideneamino] imidazole-4-carboxamide isomerase (EC 5.3.1.16) (Phosphoribosylformimino-5-aminoimidazole carboxamide ribotide isomerase)	hisA BSU34880	26529		
O35007	YVRP_BACSU	Putative efflux system protein YvrP	yvrP BSU33280	43493		
O35008	YTQA_BACSU	Uncharacterized protein YtqA	ytqA BSU30480	36764		
O35009	YOEC_BACSU	Probable integrase/recombinase YoeC	yoeC BSU18390	21371		
O35012	YKOJ_BACSU	Uncharacterized protein YkoJ	ykoJ BSU13280	18955		
O35015	YNGK_BACSU	Glycosyl hydrolase YngK (EC 3.2.1.-)	yngK yotA BSU18280	58868		
O35017	YOGA_BACSU	Uncharacterized zinc-type alcohol dehydrogenase-like protein YogA (EC 1.-.-.-)	yogA BSU18430	35811		
O35018	LMRB_BACSU	Lincomycin resistance protein LmrB	lmrB yccA BSU02670	51709		
O35019	YFKK_BACSU	UPF0435 protein YfkK	yfkK BSU07870	8135		
O35023	SODF_BACSU	Probable superoxide dismutase [Fe] (EC 1.15.1.1)	sodF BSU19330	33477		
O35024	MNTC_BACSU	Manganese transport system membrane protein MntC	mntC ytgC BSU30750	47945		SUBUNIT: The complex is probably composed of two ATP-binding proteins (MntB), two transmembrane proteins (MntC and MntD) and a solute-binding protein (MntA). {ECO:0000305|PubMed:10760146}.
O35028	YFKR_BACSU	Putative spore germination protein YfkR	yfkR BSU07780	42796		
O35034	YEFC_BACSU	Resolvase homolog YefC	yefC BSU06750	12605		
O35038	YTLI_BACSU	HTH-type transcriptional regulator YtlI	ytlI BSU29400	35233		
O35040	YKOQ_BACSU	Uncharacterized metallophosphoesterase YkoQ (EC 3.1.-.-)	ykoQ BSU13370	30877		
O35045	YJMD_BACSU	Uncharacterized zinc-type alcohol dehydrogenase-like protein YjmD (EC 1.-.-.-)	yjmD BSU12330	36762		
O35046	YOCD_BACSU	Putative carboxypeptidase YocD (EC 3.4.16.-)	yocD BSU19170	36410		
P02958	SSPC_BACSU	Small, acid-soluble spore protein C (SASP)	sspC BSU19950	7758		
P03964	TRPC_BACSU	Indole-3-glycerol phosphate synthase (IGPS) (EC 4.1.1.48)	trpC BSU22660	27741		
P04831	SSPA_BACSU	Small, acid-soluble spore protein A (SASP)	sspA BSU29570	7071		
P04832	SSPB_BACSU	Small, acid-soluble spore protein B (SASP)	sspB BSU09750	6980		
P04948	KHSE_BACSU	Homoserine kinase (HK) (HSK) (EC 2.7.1.39)	thrB BSU32240	33324		
P04969	RS11_BACSU	Small ribosomal subunit protein uS11 (30S ribosomal protein S11) (BS11)	rpsK BSU01420	13925		SUBUNIT: Part of the 30S ribosomal subunit (PubMed:30126986). Interacts with proteins S7 and S18. Binds to IF-3 (By similarity). Interacts with VmlR (PubMed:30126986). Interacts with BrxC (PubMed:33722570). {ECO:0000255|HAMAP-Rule:MF_01310, ECO:0000269|PubMed:30126986, ECO:0000269|PubMed:33722570}.
P05647	RL34_BACSU	Large ribosomal subunit protein bL34 (50S ribosomal protein L34)	rpmH BSU41060	5253		SUBUNIT: Part of the 50S ribosomal subunit. {ECO:0000269|PubMed:30126986}.
P06568	YTXB_BACSU	TVP38/TMEM64 family membrane protein YtxB (ORF-213)	ytxB BSU28970	23331		
P07372	SP2D_BACSU	Stage II sporulation protein D (Stage II sporulation protein C)	spoIID spoIIC BSU36750	37402		
P07868	GERAA_BACSU	Spore germination protein A1	gerAA gerA1 BSU33050	53810		
P07869	GERAB_BACSU	Spore germination protein A2	gerAB gerA2 BSU33060	41459		
P07870	GERAC_BACSU	Spore germination protein A3	gerAC gerA3 BSU33070	42392		
P08497	LPA2_BACSU	Aspartokinase II operon leader peptide (lysC operon attenuator peptide)	ask aecA BSU28480	2822		
P0CI76	RTP_BACSU	Replication termination protein (Replication terminator protein)	rtp BSU18490	14519		SUBUNIT: Homodimer.
P0CW80	EBRA_BACSU	Multidrug resistance protein EbrA	ebrA BSU17300	11349		SUBUNIT: The efflux pump is composed of EbrA and EbrB. {ECO:0000250}.
P0CW82	EBRB_BACSU	Multidrug resistance protein EbrB	ebrB BSU17290	12324		SUBUNIT: The efflux pump is composed of EbrA and EbrB. {ECO:0000250}.
P10585	GNTR_BACSU	Gluconate operon transcriptional repressor (P28 protein)	gntR BSU40050	28279		
P11470	GERE_BACSU	Spore germination protein GerE	gerE BSU28410	8588		
P11863	COTT_BACSU	Spore coat protein T	cotT BSU12090	10131		
P12012	GNTP_BACSU	Gluconate permease	gntP BSU40070	46655		
P12044	PURE_BACSU	N5-carboxyaminoimidazole ribonucleotide mutase (N5-CAIR mutase) (EC 5.4.99.18) (5-(carboxyamino)imidazole ribonucleotide mutase)	purE BSU06420	17174		
P12046	PUR7_BACSU	Phosphoribosylaminoimidazole-succinocarboxamide synthase (EC 6.3.2.6) (SAICAR synthetase) (Vegetative protein 286A) (VEG286A)	purC BSU06450	27460		
P12873	RL29_BACSU	Large ribosomal subunit protein uL29 (50S ribosomal protein L29)	rpmC BSU01240	7713		SUBUNIT: Part of the 50S ribosomal subunit. {ECO:0000269|PubMed:30126986}.
P12875	RL14_BACSU	Large ribosomal subunit protein uL14 (50S ribosomal protein L14)	rplN BSU01260	13154		SUBUNIT: Part of the 50S ribosomal subunit (PubMed:30126986). Forms a cluster with proteins L3 and L19. In the 70S ribosome, L14 and L19 interact and together make contacts with the 16S rRNA in bridges B5 and B8 (By similarity). {ECO:0000255|HAMAP-Rule:MF_01367, ECO:0000269|PubMed:30126986}.
P12921	TMRB_BACSU	Tunicamycin resistance protein	tmrB BSU03140	22730		
P14205	COMA2_BACSU	Putative esterase ComA2 (EC 3.1.2.-) (ComA operon protein 2)	yuxO comA2 comAB BSU31670	13681		
P14802	YOXD_BACSU	Uncharacterized oxidoreductase YoxD (EC 1.-.-.-)	yoxD BSU18500	25299		
P14951	UVRC_BACSU	UvrABC system protein C (Protein UvrC) (Excinuclease ABC subunit C)	uvrC BSU28490	68472		SUBUNIT: Interacts with UvrB in an incision complex. {ECO:0000255|HAMAP-Rule:MF_00203}.
P15281	SP3D_BACSU	Stage III sporulation protein D (14 kDa transcription factor)	spoIIID BSU36420	10802		
P16450	GERD_BACSU	Spore germination protein GerD	gerD BSU01550	21117		
P16645	HEMX_BACSU	Protein HemX	hemX BSU28160	32051		
P17622	RIBT_BACSU	Protein RibT (EC 2.3.1.-)	ribT BSU23240	14574		
P17731	HIS8_BACSU	Histidinol-phosphate aminotransferase (EC 2.6.1.9) (Imidazole acetol-phosphate transaminase)	hisC hisH BSU22620	40036		SUBUNIT: Homodimer. {ECO:0000250}.
P17868	YQXD_BACSU	UPF0178 protein YqxD (p23)	yqxD yqfM BSU25230	18936		
P18156	GLPF_BACSU	Glycerol uptake facilitator protein	glpF BSU09280	28735		
P18186	OTC_BACSU	Ornithine carbamoyltransferase (OTCase) (EC 2.1.3.3)	argF BSU11250	34663		
P19672	YQXC_BACSU	Putative rRNA methyltransferase YqxC (EC 2.1.1.-)	yqxC yqiF BSU24260	31274		
P19947	RL30_BACSU	Large ribosomal subunit protein uL30 (50S ribosomal protein L30) (BL27)	rpmD BSU01340	6638		SUBUNIT: Part of the 50S ribosomal subunit. {ECO:0000269|PubMed:30126986}.
P20167	TRPF_BACSU	N-(5'-phosphoribosyl)anthranilate isomerase (PRAI) (EC 5.3.1.24)	trpF BSU22650	24041		
P20277	RL17_BACSU	Large ribosomal subunit protein bL17 (50S ribosomal protein L17) (BL15) (BL21)	rplQ BSU01440	13751		SUBUNIT: Part of the 50S ribosomal subunit (PubMed:30126986). Contacts protein L32 (By similarity). {ECO:0000255|HAMAP-Rule:MF_01368, ECO:0000269|PubMed:30126986}.
P20692	TYRA_BACSU	Prephenate dehydrogenase (PDH) (EC 1.3.1.12)	tyrA BSU22610	41434		
P21203	PHEA_BACSU	Prephenate dehydratase (PDT) (EC 4.2.1.51)	pheA BSU27900	31901		
P21248	HEM4_BACSU	Uroporphyrinogen-III synthase (UROS) (EC 4.2.1.75) (Hydroxymethylbilane hydrolyase [cyclizing]) (Uroporphyrinogen-III cosynthase)	hemD BSU28140	29114		SUBUNIT: Monomer. {ECO:0000250}.
P21341	PAIB_BACSU	Protease synthase and sporulation protein PAI 2	paiB yumE BSU32140	24284		
P21344	SENS_BACSU	Transcriptional regulatory protein SenS	senS BSU08810	7912		
P21478	RS21_BACSU	Small ribosomal subunit protein bS21 (30S ribosomal protein S21) (BS-B)	rpsU yqeX BSU25410	6830		
P21884	YKYA_BACSU	Uncharacterized lipoprotein YkyA	ykyA ykrC BSU14570	25869		
P23261	COTF_BACSU	Spore coat protein F [Cleaved into: 5 kDa coat protein; 8 kDa coat protein]	cotF BSU40530	18725		
P23308	SINI_BACSU	Protein SinI	sinI BSU24600	6602		SUBUNIT: Heterodimer with SinR. {ECO:0000269|PubMed:9799632}.
P23446	FLGG_BACSU	Flagellar basal-body rod protein FlgG (Distal rod protein)	flgG flgE BSU16290	27455		SUBUNIT: The basal body constitutes a major portion of the flagellar organelle and consists of four rings (L,P,S, and M) mounted on a central rod. The rod consists of about 26 subunits of FlgG in the distal portion, and FlgB, FlgC and FlgF are thought to build up the proximal portion of the rod with about 6 subunits each (By similarity). {ECO:0000250}.
P23449	FLIH_BACSU	Probable flagellar assembly protein FliH	fliH BSU16230	23774		
P23451	FLIK_BACSU	Probable flagellar hook-length control protein	fliK BSU16270	53533		
P23452	FLIL_BACSU	Flagellar protein FliL	fliL BSU16300	15594		
P23455	YLXG_BACSU	FlaA locus uncharacterized protein YlxG (ORF 8)	ylxG BSU16280	15644		
P23479	SBCD_BACSU	Nuclease SbcCD subunit D	sbcD yixA BSU10640	43492		SUBUNIT: Heterodimer of SbcC and SbcD. {ECO:0000250}.
P23789	XRE_BACSU	HTH-type transcriptional regulator Xre (Putative PBSX repressor)	xre BSU12510	13258		
P24013	COX4_BACSU	Cytochrome c oxidase subunit 4B (EC 7.1.1.9) (Caa-3605 subunit 4B) (Cytochrome aa3 subunit 4B) (Cytochrome c oxidase polypeptide IVB)	ctaF BSU14920	12620		
P24277	RECR_BACSU	Recombination protein RecR	recR recD recM BSU00210	21975		
P24281	YAAK_BACSU	Nucleoid-associated protein YaaK	yaaK BSU00200	11781		SUBUNIT: Homodimer. {ECO:0000255|HAMAP-Rule:MF_00274}.
P24501	FLGC_BACSU	Flagellar basal-body rod protein FlgC	flgC BSU16190	16258		SUBUNIT: The basal body constitutes a major portion of the flagellar organelle and consists of four rings (L,P,S, and M) mounted on a central rod. The rod consists of about 26 subunits of FlgG in the distal portion, and FlgB, FlgC and FlgF are thought to build up the proximal portion of the rod with about 6 subunits each (By similarity). {ECO:0000250}.
P24502	FLIE_BACSU	Flagellar hook-basal body complex protein FliE	fliE BSU16200	11577		
P24811	YQXH_BACSU	Uncharacterized protein YqxH (ORF2)	yqxH yqdD BSU25910	15662		
P25148	GSPA_BACSU	General stress protein A	gspA ywaG BSU38430 ipa-12d	33522		
P25150	YWAE_BACSU	Uncharacterized HTH-type transcriptional regulator YwaE	ywaE BSU38450 ipa-10r	19640		
P25499	HRCA_BACSU	Heat-inducible transcription repressor HrcA	hrcA yqeS yqxE BSU25490	39028		
P25812	MNMG_BACSU	tRNA uridine 5-carboxymethylaminomethyl modification enzyme MnmG (Glucose-inhibited division protein A)	mnmG gidA BSU41010	69753		SUBUNIT: Homodimer. Heterotetramer of two MnmE and two MnmG subunits. {ECO:0000255|HAMAP-Rule:MF_00129}.
P25954	COMGB_BACSU	ComG operon protein 2	comGB comG2 BSU24720	37057		
P26381	PTFC_BACSU	Fructose permease IIC component (EIIC-Fru) (PTS system fructose-specific EIIC component) (p28)	levF BSU27050	28019		
P26382	PTFD_BACSU	Fructose permease IID component (EIID-Fru) (PTS system fructose-specific EIID component) (p30)	levG BSU27040	30087		
P26942	PRP_BACSU	Ribosomal processing cysteine protease Prp (Prp) (EC 3.4.22.-)	prp rppA ysxB BSU27950	12360		SUBUNIT: Homodimer. {ECO:0000250|UniProtKB:Q2FXS9}.
P27622	TAGC_BACSU	Putative major teichoic acid biosynthesis protein C	tagC dinC BSU35770	50826		
P27643	SP5K_BACSU	Stage V sporulation protein K	spoVK spoVJ BSU17420	36574		
P28015	SP5G_BACSU	Putative septation protein SpoVG (Stage V sporulation protein G)	spoVG BSU00490	10893		
P28611	MOTA_BACSU	Motility protein A (Chemotaxis protein MotA)	motA BSU13690	29339		SUBUNIT: Each stator complex is composed of 4 MotA and 2 MotB subunits. 2 A subunits and 1 B subunit are thought to form a single ion channel, so that each stator complex contains two channels (By similarity). {ECO:0000250}.
P31845	SP5AF_BACSU	Stage V sporulation protein AF	spoVAF BSU23390	55473		
P31847	YPUA_BACSU	Uncharacterized protein YpuA (ORFX19)	ypuA BSU23370	31295		
P32398	YHGD_BACSU	Uncharacterized HTH-type transcriptional regulator YhgD	yhgD yixD BSU10150	21794		
P32399	YHGE_BACSU	Uncharacterized protein YhgE (ORFB)	yhgE yixE BSU10160	84094		
P32437	YVYE_BACSU	IMPACT family member YvyE	yvyE yvhK BSU35510	24838		
P32726	RIMP_BACSU	Ribosome maturation factor RimP (P15A)	rimP ylxS ymxA BSU16590	17624		
P32731	RBFA_BACSU	Ribosome-binding factor A	rbfA ylxO ymxE BSU16650	13387		SUBUNIT: Monomer. Binds 30S ribosomal subunits, but not 50S ribosomal subunits or 70S ribosomes. {ECO:0000255|HAMAP-Rule:MF_00003}.
P33189	YHXA_BACSU	Uncharacterized aminotransferase YhxA (EC 2.6.-.-)	yhxA BSU09260	49877		
P33449	BMR1_BACSU	Multidrug resistance protein 1 (Multidrug-efflux transporter 1)	bmr bmr1 BSU24010	42232		
P35157	SPMA_BACSU	Spore maturation protein A	spmA ypuJ BSU23180	21494		
P35158	SPMB_BACSU	Spore maturation protein B	spmB ypuK BSU23170	18669		
P35161	RESB_BACSU	Cytochrome c biogenesis protein ResB	resB ypxB BSU23140	61761		
P35166	RSIX_BACSU	Anti-sigma-X factor RsiX (Sigma-X negative effector)	rsiX ypuN BSU23090	41295		
P35528	FLIP_BACSU	Flagellar biosynthetic protein FliP	fliP cheC BSU16350	24856		
P35536	FLIZ_BACSU	Flagellar biosynthetic protein FliZ	fliZ cheA BSU16340	24871		
P36430	SYL_BACSU	Leucine--tRNA ligase (EC 6.1.1.4) (Leucyl-tRNA synthetase) (LeuRS)	leuS BSU30320	91543		
P36944	RBSR_BACSU	Ribose operon repressor	rbsR BSU35910	35856		
P36948	RBSC_BACSU	Ribose import permease protein RbsC	rbsC BSU35950	33788		SUBUNIT: The complex is composed of an ATP-binding protein (RbsA), two transmembrane proteins (RbsC) and a solute-binding protein (RbsB). {ECO:0000250|UniProtKB:P0AGI1}.
P37104	YLXM_BACSU	UPF0122 protein YlxM	ylxM BSU15970	13165		
P37437	RL9_BACSU	Large ribosomal subunit protein bL9 (50S ribosomal protein L9) (BL17)	rplI BSU40500	16352		
P37467	XPAC_BACSU	Protein XpaC	xpaC BSU00250	23959		
P37470	PTH_BACSU	Peptidyl-tRNA hydrolase (PTH) (EC 3.1.1.29) (Stage V sporulation protein C)	spoVC pth BSU00530	20872		SUBUNIT: Monomer. {ECO:0000255|HAMAP-Rule:MF_00083}.
P37471	DIVIC_BACSU	Cell division protein DivIC	divIC divA BSU00620	14721	Q07867	
P37482	YYCB_BACSU	Uncharacterized transporter YycB	yycB BSU40480	43184		
P37483	YYCA_BACSU	Putative mannosyltransferase YycA (EC 2.4.1.-)	yycA BSU40490	73593		
P37489	YYBO_BACSU	Uncharacterized transporter YybO	yybO BSU40570	48248		
P37494	YYBJ_BACSU	Uncharacterized ABC transporter ATP-binding protein YybJ	yybJ BSU40620	24272		
